IdSon,Description,sonid,AustenderCategory,Status,internalcomment,ContractProcessingCategory,ContractProcessingSubCategory,IdCat,Title
1429,CHAIN ASSEMBLY SINGLE LEG NSN- 4010-66-086-8464,SON67191,Commercial and Military and Private Vehicles and their Accessories and Components,Inactive,,Non-ICT,Non-ICT,53,
1430,"CABLE KIT SPECIAL POWER, LIGHT EXTENSION, SCREW CAP SOCKET",SON67197,Commercial and Military and Private Vehicles and their Accessories and Components,Inactive,,Non-ICT,Non-ICT,53,
1431,SOLENOID ELECTRICAL,SON67199,Commercial and Military and Private Vehicles and their Accessories and Components,Inactive,,Non-ICT,Non-ICT,53,
1432,SHACKLE,SON67200,Commercial and Military and Private Vehicles and their Accessories and Components,Inactive,,Non-ICT,Non-ICT,53,
1433,LUBRICATING GUN HAND,SON67223,Commercial and Military and Private Vehicles and their Accessories and Components,Inactive,,Non-ICT,Non-ICT,53,
1434,"Graphic design services - design of printed material such as publications, brochures, and posters",SON67239,Graphic design,Inactive,,Non-ICT,Non-ICT,53,
1435,"Printing Services - Small volume of digital printing, Large scale offset printing, Specialist printing services",SON67277,Reproduction services,Inactive,,Non-ICT,Non-ICT,53,
1436,Provision of bus charter services for AFP,SON67385,Chartered bus services,Inactive,,Non-ICT,Non-ICT,53,
1437,"For the provision of services to conduct and facilitate industry workshops, meetings, communities of practice, good practice assessments within the Energy Efficiency Program",SON67386,Management and Business Professionals and Administrative Services,Inactive,,Non-ICT,Non-ICT,53,
1438,Provision of Fire Training Services to the Australian Antarctic Division,SON67748,Utilities,Inactive,,Non-ICT,Non-ICT,53,
1439,Provision of Intergrated Data Mgt Systems Services,SON67923,Military services and national defence,Inactive,,Non-ICT,Non-ICT,53,
1440,Provision of Systems Engineering & Logistics Support Services for NASPO,SON68023,Military services and national defence,Inactive,,Non-ICT,Non-ICT,53,
1441,Supply of Bread and Bread Rolls to Department of Defence Darwin Region,SON68094,Bread and bakery products,Inactive,,Non-ICT,Non-ICT,53,
1442,Supply of Fresh Fruit and Vegetables to Department of Defence Darwin Region,SON68121,Fruits and vegetables and nuts and seeds,Inactive,,Non-ICT,Non-ICT,53,
1443,"Supply of Meat,Bacon, Ham and Smallgoods to the Department of Defence Darwin Region",SON68133,Food and Beverage Products,Inactive,,Non-ICT,Non-ICT,53,
1444,Supply of Seafod to the Department of Defence Darwin Region,SON68137,Seafood,Inactive,,Non-ICT,Non-ICT,53,
1445,Supply of Eggs to the Department Defence Darwin Region,SON68140,Dairy products and eggs,Inactive,,Non-ICT,Non-ICT,53,
1446,Supply of Groceries to the Department of Defence Darwin Region,SON68149,Prepared and preserved foods,Inactive,,Non-ICT,Non-ICT,53,
1447,Ergonomic Workstation Assessments,SON68150,Occupational health or safety services,Inactive,,Non-ICT,Non-ICT,53,
1448,Supply Butter Cheese and Margarine to the Department of Defence Darwin Region,SON68151,Dairy products and eggs,Inactive,,Non-ICT,Non-ICT,53,
1449,"Supply of Milk, Cream and Yogurt to the Department of Defence Darwin Region",SON68153,Dairy products and eggs,Inactive,,Non-ICT,Non-ICT,53,
1450,Supply of Frozen Goods to the Department of Defence Darwin Region,SON68154,Prepared and preserved foods,Inactive,,Non-ICT,Non-ICT,53,
1451,Supply of Meat Cuts and Offal to the Department of Defence RAAF Base Tindal,SON68156,Fresh processed or prepared meats,Inactive,,Non-ICT,Non-ICT,53,
1452,Supply of Bread and Bread Rolls to the Department of Defence RAAF Base Tindal,SON68157,Bread and bakery products,Inactive,,Non-ICT,Non-ICT,53,
1453,Supply of Seafood to the Department of Defence RAAF Base Tindal,SON68158,Seafood,Inactive,,Non-ICT,Non-ICT,53,
1454,"Supply Milk, Cream and Yogurt to the Department of Defence RAAF Base Tindal",SON68159,Dairy products and eggs,Inactive,,Non-ICT,Non-ICT,53,
1455,Supply of Fresh Fruit & Vegetables to the Department of Defence RAAF Base Tindal,SON68160,Fruits and vegetables and nuts and seeds,Inactive,,Non-ICT,Non-ICT,53,
1456,SUpply of Postmix Products and Machines to Department Of Defence Darwin and Katherine Region,SON68183,Soft drinks,Inactive,,Non-ICT,Non-ICT,53,
1457,"NSN- 2540-66-155-8552/2540-66-155-8558 DESCRIPTION- BOX,ACCESSSORIES STOWAGE-DOUBLE LOCKER AND BOX ACCESSORIES STOWAGE LOCKER ASSEMLBY-REAR LEFT",SON68243,Commercial and Military and Private Vehicles and their Accessories and Components,Inactive,,Non-ICT,Non-ICT,53,
1458,Supply and maintenance of indoor plants,SON68255,Non flowering plants,Inactive,,Non-ICT,Non-ICT,53,
1459,Deed of Standing Offer for the provision of overseas sourced IVIG products,SON68277,Healthcare Services,Inactive,,Non-ICT,Non-ICT,53,
1460,Supply of Security Vetting Services,SON69013,Security and personal safety,Inactive,,Non-ICT,Non-ICT,53,
1461,The provision of Contract Services in relation to supply of workstations and loose furniture for various ACCC office accommodation fitouts around Australia.,SON70676,Commercial and industrial furniture,Inactive,,Non-ICT,Non-ICT,53,
1462,"Maintenance of Aircraft Flight Control Servo Mechanisms, microgrinding, and Associated Technical Services",SON68666,Aircraft,Inactive,,Non-ICT,Non-ICT,53,
1463,Supply of Continuous Positive Airways Pressure (CPAP) equipment and services to entitled persons.,SON70737,Medical Equipment and Accessories and Supplies,Inactive,,Non-ICT,Non-ICT,53,
1464,For the provision of project management training and related services under a panel arrangemen,SON70768,Education and Training Services,Inactive,,Non-ICT,Non-ICT,53,
1465,Supply & fit out vehicle roof mounted lights & sirens,SON70921,Light weapons and ammunition,Inactive,,Non-ICT,Non-ICT,53,
1466,Salary Packaging agreement,SON71034,Employee benefits law services,Inactive,,Non-ICT,Non-ICT,53,
1467,Provision of auditing services for CRS Australia,SON71040,Government auditing services,Inactive,,Non-ICT,Non-ICT,53,
1468,"NSN'S- 4720-66-154-4392,5945-99-733-6844/3040-66-156-6811 DESCRIPTION- HOSE ASSEMBLY,NONMETALLIC, CUTOUT,THERMAL AND LEVER,REMOTE CONTROL.",SON71343,Commercial and Military and Private Vehicles and their Accessories and Components,Inactive,,Non-ICT,Non-ICT,53,
1469,"NSN'S- 2540-66-152-1369,3950-01-540-2999,4730-66-156-7140/4730-66-156-7137/4730-66-156-6821/2520-66-156-7134/5130-66-152-0202/5340-66-152-2618. DESCRIPTION- MIRROR HEAD VEHICULAR, TENSIONER PULLEY ASSEMBLY, REDUCER TUBE, ELBOW,TUBE TO HOSE,ELBOW TUBE, BREATHER, BLADE METAL CUTTER, & ROD STRAIGHT HEADLESS.",SON71344,Commercial and Military and Private Vehicles and their Accessories and Components,Inactive,,Non-ICT,Non-ICT,53,
1470,NSN- 6140-66-152-4556 DESCRIPTION- BATTERY STORAGE (PART NUMBER) BMA13501,SON71345,Commercial and Military and Private Vehicles and their Accessories and Components,Inactive,,Non-ICT,Non-ICT,53,
1471,Management and Provision of Language Tuition Services,SON71493,Business administration services,Inactive,,Non-ICT,Non-ICT,53,
1472,NHMRC register of Independent Reviewers,SON45153,Management and Business Professionals and Administrative Services,Inactive,,Non-ICT,Non-ICT,53,
1473,Security Patrol Attendance after hours,SON71923,Security and personal safety,Inactive,,Non-ICT,Non-ICT,53,
1474,Refurbishment of Bronze plaques at the WA Garden of Rememberance,SON71924,Building construction and support and maintenance and repair services,Inactive,,Non-ICT,Non-ICT,53,
1475,Independant Guideline Consultant,SON71983,Management and Business Professionals and Administrative Services,Inactive,,Non-ICT,Non-ICT,53,
1476,Delivery of Linguistic services including training delivery and language proficiency testing. This amendment has corrected the following: Agency Refence ID Category ATM ID The Agency Details have also been updated,SON71984,Education and Training Services,Inactive,,Non-ICT,Non-ICT,53,
1477,Conference Facilities and catering services for training conducted by SPS in Canberra,SON72001,Educational facilities,Inactive,,Non-ICT,Non-ICT,53,
1478,Project Support Services,SON72307,Human resources services,Inactive,,Non-ICT,Non-ICT,53,
1479,Printing Services,SON72441,Offset industrial printing services,Inactive,,Non-ICT,Non-ICT,53,
1480,"TANK FABRIC COLLAPSIBLE (WATER) ASSEMBLY- PILLOW SHAPED TANKS 22,500 LITRE AND 136,000 LITRE.",SON72550,Water storage tanks,Inactive,,Non-ICT,Non-ICT,53,
1481,Supply of Iroquois R3/R4 Deeper Maintenance,SON72555,Military rotary wing aircraft,Inactive,,Non-ICT,Non-ICT,53,
1482,"Supply of Deeper Maintenance of Iroquois and Kiowa Transmissions, Drive Train and Ancillary Equipment and miscellaneous Bell Aircraft Components.",SON72591,Military rotary wing aircraft,Inactive,,Non-ICT,Non-ICT,53,
1483,FALL PREVENTION/PROTECTION DEVICES FOR ADF VEHICLES,SON72605,Safety slings,Inactive,,Non-ICT,Non-ICT,53,
1484,"Deeper Maintenance of Iroquois, Kiowa and Blackhawk Helicopter Main and Tail Rotor Blades and Blackhawk Tip Caps",SON72657,Military rotary wing aircraft,Inactive,,Non-ICT,Non-ICT,53,
1485,"Deeper Maintenance of Lycoming T53 Engines, Components and Accessories",SON72661,Military rotary wing aircraft,Inactive,,Non-ICT,Non-ICT,53,
1486,Deeper Maintenance of Blackhawk and Chinook Aircraft,SON72664,Military rotary wing aircraft,Inactive,,Non-ICT,Non-ICT,53,
1487,"Supply of Management of Repairable Items, Provision of a Technical Assistance Agreement and a Spares Provisioning Agreement for the Australian Army S-70A-9 and Royal Australian Navy S-70B-2 Helicopter Fleets and RAAF Aircraft",SON72666,Military rotary wing aircraft,Inactive,,Non-ICT,Non-ICT,53,
1488,Maintenance of Bell 206B (Kiowa) Helicopters,SON72669,Military rotary wing aircraft,Inactive,,Non-ICT,Non-ICT,53,
1489,Provision of security advisory services,SON72703,Business administration services,Inactive,,Non-ICT,Non-ICT,53,
1490,Legal Services - DFAT Legal Panel,SON72705,Legal services,Inactive,,Non-ICT,Non-ICT,53,
1491,Management and Professional Skills Training,SON72707,Education and Training Services,Inactive,,Non-ICT,Non-ICT,53,
1492,7500L WATER STORAGE TANKS,SON72745,Water storage tanks,Inactive,,Non-ICT,Non-ICT,53,
1493,Repair and Refurbishment of ANZAC Class Frigate Pumps,SON72813,Industrial pumps and compressors,Inactive,,Non-ICT,Non-ICT,53,
1494,"Provision of Maintenance, Parts and Documentation Support, Repair, Testing and Overhaul for Reverse Osmosis Desalination System fitted to FFG Class Ships.",SON72814,Industrial filtering and purification,Inactive,,Non-ICT,Non-ICT,53,
1495,"Provision of maintenance support, spare parts, repair and testing of HP and LP compressors fitted to the FFG Class.",SON72818,Industrial pumps and compressors,Inactive,,Non-ICT,Non-ICT,53,
1496,"Repair, Overhaul & spares support for Reverse Osmisis Units",SON72819,Industrial filtering and purification,Inactive,,Non-ICT,Non-ICT,53,
1497,Supply and Support of ANZAC Class Under Water Valves.,SON72820,Fluid and gas distribution,Inactive,,Non-ICT,Non-ICT,53,
1498,Repair and Refurbishment of HP and LP air Manifolds for the FFG Class,SON72823,Fluid and gas distribution,Inactive,,Non-ICT,Non-ICT,53,
1499,Supply of PAT 50N Life Preservers,SON72857,Personal safety and protection,Inactive,,Non-ICT,Non-ICT,53,
1500,Training Services,SON72866,Electronic educational or vocational texts,Inactive,,Non-ICT,Non-ICT,53,
1501,Vetting Services,SON72872,Human resources services,Inactive,,Non-ICT,Non-ICT,53,
1502,Vetting Services,SON72875,Human resources services,Inactive,,Non-ICT,Non-ICT,53,
1503,Vetting Services,SON72877,Human resources services,Inactive,,Non-ICT,Non-ICT,53,
1504,Vetting Services,SON72878,Human resources services,Inactive,,Non-ICT,Non-ICT,53,
1505,Vetting Services,SON72880,Human resources services,Inactive,,Non-ICT,Non-ICT,53,
1506,Vetting Services,SON72883,Human resources services,Inactive,,Non-ICT,Non-ICT,53,
1507,Employee Assistance Program,SON72887,Human resources services,Inactive,,Non-ICT,Non-ICT,53,
1508,Employee Assistance Program,SON72889,Human resources services,Inactive,,Non-ICT,Non-ICT,53,
1509,Employee Assistance Program,SON72890,Human resources services,Inactive,,Non-ICT,Non-ICT,53,
1510,Employee Assistance Program,SON72891,Human resources services,Inactive,,Non-ICT,Non-ICT,53,
1511,Employee Assistance Program,SON72892,Human resources services,Inactive,,Non-ICT,Non-ICT,53,
1512,Employee Assistance Program,SON72893,Human resources services,Inactive,,Non-ICT,Non-ICT,53,
1513,Employee Assistance Program,SON72895,Human resources services,Inactive,,Non-ICT,Non-ICT,53,
1514,Employee Assistance Program,SON72897,Human resources services,Inactive,,Non-ICT,Non-ICT,53,
1515,85709562513,SON72939,Project management,Inactive,,Non-ICT,Non-ICT,53,
1516,ChildCare Services,SON72954,Human resources services,Inactive,,Non-ICT,Non-ICT,53,
1517,IN SERVICE SUPPORT FOR WARRENDI PERSONAL LOCATOR BEACON,SON72980,Lifelines or lifeline equipment,Inactive,,Non-ICT,Non-ICT,53,
1518,Freelance Communication Services MUL,SON72984,Communications Devices and Accessories,Inactive,,Non-ICT,Non-ICT,53,
1519,Panel arrangement for the supply of records management and archival services,SON72992,Information services,Inactive,,Non-ICT,Non-ICT,53,
1520,NSN- 6115-66-156-7377. DESCRIPTION- ALTERNATING CURRENT.,SON73130,Commercial and Military and Private Vehicles and their Accessories and Components,Inactive,,Non-ICT,Non-ICT,53,
1521,"NSN'S- 4730-66-155-2808/4720-66-152-8749/3020-66-152-8379/4720-66-154-4392 & 5120-66-154-9061. DESCRIPTION-CLAMP HOSE, HOSE,NONMETALLIC, PULEY GROOVE,HOSE ASSEMBLY NONMETALLIC AND INSERTER,BEARING.",SON73137,Commercial and Military and Private Vehicles and their Accessories and Components,Inactive,,Non-ICT,Non-ICT,53,
1522,"NSN'S- 3020-66-152-8379/4730-66-155-2808/5315-01-557-2876/ DESCRIPTION- PULLEY GROOVE, CLAMP HOSE, AND PIN,EXPANDING GRIP.",SON73141,Commercial and Military and Private Vehicles and their Accessories and Components,Inactive,,Non-ICT,Non-ICT,53,
1523,Provision of Research Services for the Adult Migrant English Program,SON73478,Educational and research structures,Inactive,,Non-ICT,Non-ICT,53,
1524,Appointment as an approved firm to uplift and reproduce Produced Documents from the Registry of a Court or Tribunal and other legal document services.,SON73607,Photocopying,Inactive,,Non-ICT,Non-ICT,53,
1525,Provision for PS146 Superannuation Training,SON73623,Education and Training Services,Inactive,,Non-ICT,Non-ICT,53,
1526,Utensisl Various,SON73699,Restaurants and catering,Inactive,,Non-ICT,Non-ICT,53,
1527,Knives,SON73702,Restaurants and catering,Inactive,,Non-ICT,Non-ICT,53,
1528,Standing Offer for the supply of various tool kits,SON73705,Tools and General Machinery,Inactive,,Non-ICT,Non-ICT,53,
1529,Standing Offer for the Supply of various tool kits,SON73706,Tools and General Machinery,Inactive,,Non-ICT,Non-ICT,53,
1530,Tricon Shipping and Storage Containers,SON73709,Containers and storage,Inactive,,Non-ICT,Non-ICT,53,
1531,Shipping and Storage Containers - ISO,SON73711,Containers and storage,Inactive,,Non-ICT,Non-ICT,53,
1532,Services for amendments to aged care legislation,SON73800,Business law services,Inactive,,Non-ICT,Non-ICT,53,
1533,Supply of Office Chairs,SON73848,Chairs,Inactive,,Non-ICT,Non-ICT,53,
1534,"GARRISON JACKETS, ARMY",SON73851,Coats and jackets,Inactive,,Non-ICT,Non-ICT,53,
1535,"CLIP RETAINING,WINDOW VEHICULAR GLASS 311.0M, WINDOW VEHICULAR GLASS 571.0MM,WINDOW VEHICULAR GLASS 952.0MM, WINDOW VEHICULAR GLASS 952.0M, WINDOW VEHICULAR GLASS 1944.0 MM.",SON74026,Commercial and Military and Private Vehicles and their Accessories and Components,Inactive,,Non-ICT,Non-ICT,53,
1536,CABLE ASSEMBLY-SWITCH ELECTRICAL AND STEERING GEAR. NSN'S-6150-66-155-1991/2530-66-152-8418,SON74032,Commercial and Military and Private Vehicles and their Accessories and Components,Inactive,,Non-ICT,Non-ICT,53,
1537,Supply of SodaLime,SON78205,Light weapons and ammunition,Inactive,,Non-ICT,Non-ICT,53,
1538,Spares and Repair Services for Hedemora Diesel Engine,SON79942,Commercial and Military and Private Vehicles and their Accessories and Components,Inactive,,Non-ICT,Non-ICT,53,
1539,Repair of Blackmer Pumps,SON80099,Commercial and Military and Private Vehicles and their Accessories and Components,Inactive,,Non-ICT,Non-ICT,53,
1540,Blades and Hubs for ANZAC & FFG Class,SON80216,Marine craft systems and subassemblies,Inactive,,Non-ICT,Non-ICT,53,
1541,"Supply, Spares support and Training of Portable Gas Detection Units",SON80297,Personal safety and protection,Inactive,,Non-ICT,Non-ICT,53,
1542,Provision of train the trainer services associated with the 'Influencing & Motivating Customers Program',SON74429,Alternative educational systems,Inactive,,Non-ICT,Non-ICT,53,
1543,Market Research,SON82147,Management and Business Professionals and Administrative Services,Inactive,,Non-ICT,Non-ICT,53,
1544,Management and Professional Skills Training,SON83978,Education and Training Services,Inactive,,Non-ICT,Non-ICT,53,
1545,Publication Management Services,SON84067,Management and Business Professionals and Administrative Services,Inactive,,Non-ICT,Non-ICT,53,
1546,TDP Training Services Panel,SON84068,Education and Training Services,Inactive,,Non-ICT,Non-ICT,53,
1547,Provision of Veteran's home care services.,SON84989,Domestic and personal assistance,Inactive,,Non-ICT,Non-ICT,53,
1548,Banking Services.,SON85001,Banking institutions,Inactive,,Non-ICT,Non-ICT,53,
1549,"Provision of Aircraft Maintenance, Repair, Technical and Repair Services, including Aircraft Engines and Accessories, Components and Associated Equipment",SON72530,Military rotary wing aircraft,Inactive,,Non-ICT,Non-ICT,53,
1550,Master media planning and placement agency for campaign advertising.,SON85435,Marketing and distribution,Inactive,,Non-ICT,Non-ICT,53,
1551,Master media planning and placement agency for non-campaign advertising,SON85437,Marketing and distribution,Inactive,,Non-ICT,Non-ICT,53,
1552,Australian Commission on Safety and Quality in Health Care (ACSQHC) Panel of Specialist Contractors for services relating to Safety and Quality in Health Panel members have been appointed to offer one or a variety of the following categories of services: - Health Information Systems - Clinical Safety and Quality Expertise - Facilitation and Program Support - Health Economist Advisory Services Health Issues and Literature Review - Media and Communications Advice - Editing and/or Publishing Services - Education Services - Business and Advisory Support Services - Research Brokerage,SON85018,Management and Business Professionals and Administrative Services,Inactive,,Non-ICT,Non-ICT,53,
1553,Reports of Data Related to Drugs Prescribed in the Australian Community,SON86195,Business intelligence consulting services,Inactive,,Non-ICT,Non-ICT,53,
1554,Communication Market Research Panel,SON86266,Market research,Inactive,,Non-ICT,Non-ICT,53,
1555,Provision of security examination services for conducting X-ray Technology Capability and Industry Impact Trials in the Air Cargo Environment,SON86276,Security and control equipment,Inactive,,Non-ICT,Non-ICT,53,
1556,Provision of Analysis Services,SON86666,National planning services,Inactive,,Non-ICT,Non-ICT,53,
1557,Imported IVIg Products Deed,SON87192,Comprehensive health services,Inactive,,Non-ICT,Non-ICT,53,
1558,Data Analytics Specialist Services,SON87201,Information services,Inactive,,Non-ICT,Non-ICT,53,
1559,Whole of CASA General Stationery & Office Supplies,SON87331,Stationery,Inactive,,Non-ICT,Non-ICT,53,
1560,Stonefish Exercise Mine (SEM) Support Contract Extension CAPONN260304,SON90139,Electrical equipment and components and supplies,Inactive,,Non-ICT,Non-ICT,53,
1561,Services relating to the results through people program,SON90328,Vocational training,Inactive,,Non-ICT,Non-ICT,53,
1562,Recruitment of Heads of Agencies,SON90494,Personnel recruitment,Inactive,,Non-ICT,Non-ICT,53,
1563,Services for Assessment of Application in the Recruitment Process,SON90495,Management and Business Professionals and Administrative Services,Inactive,,Non-ICT,Non-ICT,53,
1564,Support Services for Standard Business Reporting Panel. This start date is for the option term.,SON61939,Management and Business Professionals and Administrative Services,Inactive,,Non-ICT,Non-ICT,53,
1565,ELECTRICITY CHARGES,SON73687,Supply of three phase electricity,Inactive,,Non-ICT,Non-ICT,53,
1566,Aircraft Spares QTY 4 NSN 5905-01-322-2258 DIMMING UNIT,SON90861,Aircraft,Inactive,,Non-ICT,Non-ICT,53,
1567,Aircraft Spares QTY 11 NSN 6610-01-560-6809 ACCELEROMETER ELECTRICAL LINEAR,SON90871,Aircraft,Inactive,,Non-ICT,Non-ICT,53,
1568,Provision of Personnel,SON91042,Medical practice,Inactive,,Non-ICT,Non-ICT,53,
1569,Supply of GPS devices,SON91072,Consumer electronics,Inactive,,Non-ICT,Non-ICT,53,
1570,Early Intervention Services,SON92287,Healthcare Services,Inactive,,Non-ICT,Non-ICT,53,
1571,Actuarial Services Panel,SON92339,Financial and Insurance Services,Inactive,,Non-ICT,Non-ICT,53,
1572,Domestic & International Airline and Travel Management Services,SON92639,Travel and Food and Lodging and Entertainment Services,Inactive,,Non-ICT,Non-ICT,53,
1573,Provision of Forensic Medical Services to ACT policing,SON93303,Temporary medical staffing needs,Inactive,,Non-ICT,Non-ICT,53,
1574,Provision of Equipment for Hygiene and Infection Control Products,SON94136,Personal safety and protection,Inactive,,Non-ICT,Non-ICT,53,
1575,Equipment for Hygiene and Infection Control Products,SON94141,Personal safety and protection,Inactive,,Non-ICT,Non-ICT,53,
1576,AERIAL DIGITAL IMAGERY ACQUISITION SYSTEM (ADIAS) UPGRADE PROGRAM,SON94158,Aerial cameras,Inactive,,Non-ICT,Non-ICT,53,
1577,English Translation Services Panel,SON304,Writing and translations,Inactive,,Non-ICT,Non-ICT,53,
1578,Printing of Certified Lists,SON94626,Industrial printing services,Inactive,,Non-ICT,Non-ICT,53,
1579,The Provision of Security Monitoring and Alarm Services,SON94714,Security surveillance and detection,Inactive,,Non-ICT,Non-ICT,53,
1580,CHEMICAL EVALUATON OF APPLICATIONS,SON94800,Chemicals including Bio Chemicals and Gas Materials,Inactive,,Non-ICT,Non-ICT,53,
1581,Supply agreement for provision of Uninterruptible Power Supply (UPS) equipment and associated services,SON94811,Power supply units,Inactive,,Non-ICT,Non-ICT,53,
1582,Electrical Office Machines and Electrical Appliances,SON94821,Domestic Appliances and Supplies and Consumer Electronic Products,Inactive,,Non-ICT,Non-ICT,53,
1583,For the provision and payment of emergency and non-emergency transport services to entitled persons.,SON95436,Comprehensive health services,Inactive,,Non-ICT,Non-ICT,53,
1584,Supply of Fabric,SON95605,Specialty fabrics or cloth,Inactive,,Non-ICT,Non-ICT,53,
1585,Supply of Cleaning and Washroom Services Nationally,SON95725,Washroom sanitation services,Inactive,,Non-ICT,Non-ICT,53,
1586,Indoor Plant (Vegetation) Hire Services Panel,SON95726,Live Plant and Animal Material and Accessories and Supplies,Inactive,,Non-ICT,Non-ICT,53,
1587,"FISTURE LIGHTING,FASTENER TAPE, CLAMP LOOP,NET,DRAFT COVER, WIRING HARNESS, NET MUTIPURPOSE, TIE DOWN CARGO VEHICLE, PLUG ASSEMBLY SEALING NET MOUNT PROPAQ, SPRING HELICAL TORSION, NET SUCTION UNIT AND PLUG ASSEMBLY SEALING.",SON95748,Commercial and Military and Private Vehicles and their Accessories and Components,Inactive,,Non-ICT,Non-ICT,53,
1588,06/1468 - Standing Offer for the Provision of Stationery,SON95844,Stationery,Inactive,,Non-ICT,Non-ICT,53,
1589,Provision of Professional Services to develop joint doctrine Publications,SON98367,Business administration services,Inactive,,Non-ICT,Non-ICT,53,
1590,Client Service Agreement for the provision of personnel Security Vetting Services,SON98436,Management and Business Professionals and Administrative Services,Inactive,,Non-ICT,Non-ICT,53,
1591,Deed of Standing Offer for the supply of Instrument Shelters and Component Panel Sections,SON98545,Laboratory and Measuring and Observing and Testing Equipment,Inactive,,Non-ICT,Non-ICT,53,
1592,"The Directorate of Leadership Values and Cultural Engagement within People Strategies and Policy Group has established a Standing Offer Panel to deliver programs, workshops, tools, development and intervention strategies, and/or projects that support the Results through People (RtP) philosophy in Defence.",SON98692,Management and Business Professionals and Administrative Services,Inactive,,Non-ICT,Non-ICT,53,
1593,Provision of Parliamentary Security Services uniforms and accessories (extension of Standing Offer DPS04004). Originally gazetted GAPS ID: 1603409 and CN20408),SON99419,Security uniforms,Inactive,,Non-ICT,Non-ICT,53,
1594,Provision of Aeromedical Evacuation Services to Northern Australia,SON100539,Comprehensive health services,Inactive,,Non-ICT,Non-ICT,53,
1595,Postal Services - Billpay,SON101039,Billing services,Inactive,,Non-ICT,Non-ICT,53,
1596,Provision of Equipment for Hygiene and Infection Control Products,SON101047,Personal safety and protection,Inactive,,Non-ICT,Non-ICT,53,
1597,Provision of clostridium botylinum type A,SON101060,Medical Equipment and Accessories and Supplies,Inactive,,Non-ICT,Non-ICT,53,
1598,Development and Delivery Threat and Error Management (TEM) Training Course,SON87394,Work ethics or attitude training instructional materials,Inactive,,Non-ICT,Non-ICT,53,
1599,For the provision of Locksmith Services to Master Key System for Caroline Chisholm Centre,SON101366,Locks and security hardware and accessories,Inactive,,Non-ICT,Non-ICT,53,
1600,Contracted legal services and support,SON101393,Legal services,Inactive,,Non-ICT,Non-ICT,53,
1601,To provided technical support for the DVATS system for the provision of taxis and hire cars for veterans travel to treatment,SON101394,Travel facilitation,Inactive,,Non-ICT,Non-ICT,53,
1602,Provision of ergonomic office chairs,SON101522,Chairs,Inactive,,Non-ICT,Non-ICT,53,
