IdSon,Description,sonid,AustenderCategory,Status,internalcomment,ContractProcessingCategory,ContractProcessingSubCategory,IdCat,Title
1,"Under the Australian Government Telecommunications Arrangements (AGTA), a provider of telecommunications carriage services (as defined in the Telecommunications Act 1997 ) must sign an AGTA Head Agreement with the Commonwealth (containing standard terms and conditions) before they can provide such services to FMA Act agencies and certain CAC Act agencies. Also, it is preferred that a provider of other telecommunications related goods and services to such agencies do so in accordance with an AGTA Head Agreement between the provider and the Commonwealth. Further information on AGTA is available at: http://www.finance.gov.au/procurement/ict-procurement/australian-government-telecommunications-arrangement/index.html or by contacting Director, Telecommunications Team, Australian Government Information Management Office, Department of Finance and Deregulation by telephone (02 6215 1535) or by email ictprocurement@finance.gov.au Note: the end date is not 2050 but has been supplied for the purposes of listing an end date on AusTender. This is an ongoing arrangement. For further information on the way the AGTA works please contact ictprocurement@finance.gov.au",SON88680,Components for information technology or broadcasting or telecommunications,Active,,Telecommunications,Uncategorised,40,
2,Provision of Data Storage Backup and Recovery Infrastructure,SON191674,Data Voice or Multimedia Network Equipment or Platforms and Accessories,Active,,Hardware,Storage,9,
3,Hyper Text Mark-up Language (HTML) Conversion Services Panel,SON297971,Software maintenance and support,Active,,ICT,Uncategorised,17,
4,Head agreement for the provision of Microsoft Software and related support services,SON176030,Software,Active,,ICT,Uncategorised,27,
5,Head Agreement for the provision of Microsoft Software and related support services,SON176460,Software,Active,,Software,Microsoft,27,
6,Head Agreement of Microsoft Software of the Whole of Government (Volume Sourcing Agreement),SON186756,Software,Active,,Software,Microsoft,27,
7,IBM Head Agreement,SON200019,Software,Active,,ICT,Uncategorised,28,
8,ICT Professionals Panel,SON299780,Temporary personnel services,Active,This panel remains active despite advice from Finance that it is not an ICT panel because it is an ICT Labour Hire Panel,Labour Hire,ICT Labour Hire,13,
9,Recruitment and Scribing Services,SON287528,Personnel recruitment,Inactive,This panel was originally uploaded as 'active' because it was a mixed panel. However it has since been marked inactive by HF & SK (SK 11/04/2013),Uncategorised,Uncategorised,13,
10,Work Management Solution,SON310369,Software,Active,,ICT,Uncategorised,17,
11,IBM Enterprise Licence Agreement,SON310476,Software maintenance and support,Active,,ICT,Uncategorised,15,
12,Panel for provision of capacity building services in support of the AFP's police capacity building programs - Advisory services,SON310302,Project management,Inactive,Date changed from 31 May 2014 to 31 May 2015,Uncategorised,Uncategorised,11,
13,Panel for provision of capacity building services in support of the AFP's police capacity building programs - Learning and development services,SON310310,Project management,Inactive,Date changed from 31 May 2014 to 31 May 2015,Uncategorised,Uncategorised,11,
14,Services and Support for Manpower Analysis and Planning Systems (MAPS) Software,SON190876,Software,Active,Date changed from 06 May 2013 to 06 May 2015,ICT,Uncategorised,18,
15,Hardware aquisition and maintenance of equipment to support the ICT infrastructure,SON286598,Computer hardware maintenance or support,Active,,ICT,Uncategorised,7,
16,IT Professional services panel to provide; Program Consultancy services Continuous improvement services Application consultancy services Telecommunications consultancy services Technical consultancy services,SON310345,Information technology consultation services,Active,,IT Services,Uncategorised,11,
17,ICT Managed Services,SON269193,Computer hardware maintenance or support,Active,,IT Services,Managed Services,14,
18,Graphics System Replacement,SON100658,Components for information technology or broadcasting or telecommunications,Active,,ICT,Uncategorised,1,
19,Enterprise Data Storage Technology and Disaster Recovery Infrastructure and Associated Equipment,SON67198,Data storage,Active,,ICT,Uncategorised,9,
20,Provision of Rental Financing Facility for IT and Office Equipment,SON234404,Credit agencies,Active,,ICT,Uncategorised,7,
21,"Digital Media Presentation, Management And Online Engagement Services",SON263913,Telecommunications media services,Inactive,,Uncategorised,Uncategorised,17,
22,"Training Command-Army (TC-A) has a Standing Offer Panel for Vocational Education & Training (SOPVET). Service categories are: Defence Training Model Analysis, Design, Development, Evaluation; Specialsit Training Research & Consultancy; Management & Information Communication & Technology Consultancy; Course Administration and Training Support Recruitment Agency.",SON42172,Education and Training Services,Inactive,This panel was originally uploaded as 'active' because it was a mixed panel. However it has since been marked inactive by HF & SK (SK 11/04/2013),Uncategorised,Uncategorised,19,
23,Provision of ICT Business Support Services,SON64416,Information technology consultation services,Active,,ICT,Uncategorised,47,
24,Master Leasing Facility for acquisition of IT equipment.,SON59102,Operating lease finance service,Active,,ICT,Uncategorised,7,
25,Development and maintenance of metadata collection and management tools,SON294834,Application implementation services,Active,,ICT,Uncategorised,17,
26,"Technical, Project Management, Documentation and Training Services",SON253476,Information technology consultation services,Active,,ICT,Uncategorised,47,
27,Deed of Standing Offer for the provision of financial and other consultancy services.,SON264607,Strategic planning consultation services,Inactive,This panel was originally uploaded as 'active' because it was a mixed panel. However it has since been marked inactive by HF & SK (SK 11/04/2013),Uncategorised,Uncategorised,11,
28,Logistics Information Systems Software,SON300113,Information technology consultation services,Active,,ICT,Uncategorised,25,
29,Deed of Standing Offer for analyst's software and associated licences,SON291902,Software,Active,Date updated from 14/12/2013 to 14/12/2014 (SK 12/03/2014),ICT,Uncategorised,31,
30,"Printer, Photocopier, Scanner and Facsimile Equipment",SON51280,Printer and facsimile and photocopier supplies,Active,,Hardware,Printer and Printer Services,8,
31,Voice telecommunication and associated services,SON244485,Data Voice or Multimedia Network Equipment or Platforms and Accessories,Active,,ICT,Uncategorised,44,
32,091113 - Software Product Support,SON265931,Software maintenance and support,Active,,ICT,Uncategorised,18,
33,Provision of SAP Support and Maintenance,SON232421,Software maintenance and support,Active,,ICT,Uncategorised,18,
34,Provision of video confrencing system,SON231316,Phone and video conference equipment and hardware and controllers,Active,Date updated from 30/09/2013 to 30/09/2014 (SK 12/03/2014),ICT,Uncategorised,43,
35,"Expert (Economic, Financial and Technical) Consultancy Panel for the Australian Competition and Consumer Commission, including the Australia Energy Regulator (AER)",SON249943,Management advisory services,Inactive,This panel was originally uploaded as 'active' because it was a mixed panel. However it has since been marked inactive by HF & SK (SK 11/04/2013),Uncategorised,Uncategorised,11,
36,"Provision of Software, Software Development, Support and Consulltancy Services",SON236880,Software,Active,,ICT,Uncategorised,48,
37,Information Technology Business Transformation Services,SON308684,Information technology consultation services,Active,,ICT,Uncategorised,47,
38,Provision of training services to Department of Defence,SON98662,Education and Training Services,Inactive,ATM ID: DBTC RFT CON G 001/2007,Uncategorised,Uncategorised,19,
39,Provision of ICT Professionals,SON196975,Information technology consultation services,Active,,IT Services,Uncategorised,13,
40,Provision for the Maintenance and Development of the e-tax System.,SON227214,Software maintenance and support,Active,,IT Services,SI Services,47,
41,Provision of CCTV and Security Related Installation and Maintenance Services under a Standing Offer Panel Arrangement,SON308571,Security surveillance and detection,Inactive,This panel was originally uploaded as 'active' because it was a mixed panel. However it has since been marked inactive by HF & SK (SK 11/04/2013),Uncategorised,Uncategorised,17,
42,08/3281 - IT Consultancy and Support Services,SON223486,Information technology consultation services,Active,,ICT,Uncategorised,47,
43,Service Oriented Architecture Products and Services,SON190967,Computer Equipment and Accessories,Active,,ICT,Uncategorised,29,
44,Peoplesoft HRMS & FMIS Support & Maintenance Services,SON199453,ERP or database applications programming services,Active,,ICT,Uncategorised,18,
45,SmartForms solution. A panel of providers that can assist agencies in developing online forms.,SON227846,Components for information technology or broadcasting or telecommunications,Active,,ICT,Uncategorised,11,
46,Provision of Information Technology Training Services for Core End-User Services,SON182229,Education and Training Services,Active,,ICT,Uncategorised,19,
47,Provision of Online Content Writers/Producers,SON286439,Editorial and support services,Active,,ICT,Uncategorised,11,
48,Provision of Audio Visual and Teleconferencing Equipment and Services,SON183491,Information Technology Broadcasting and Telecommunications,Active,,ICT,Uncategorised,43,
49,Panel for the Provision of Recruitment Services,SON283168,Human resources services,Inactive,This panel was originally uploaded as 'active' because it was a mixed panel. However it has since been marked inactive by HF & SK (SK 11/04/2013),Uncategorised,Uncategorised,13,
50,Cabling Services,SON233113,Data services,Active,,ICT,Uncategorised,32,
51,Provision of office machines and accessories,SON179446,Office machines and their supplies and accessories,Active,,Hardware,Uncategorised,7,
52,Recruitment Services,SON189143,Personnel recruitment,Inactive,This panel was originally uploaded as 'active' because it was a mixed panel. However it has since been marked inactive by HF & SK (SK 11/04/2013),Uncategorised,Uncategorised,13,
53,Purchase of Hardware and Services for the OES Branch Infrastructure,SON286613,Computer hardware maintenance or support,Active,,ICT,Uncategorised,7,
54,ICT Infrastructure Support Services,SON200274,Information Technology Broadcasting and Telecommunications,Active,,ICT,Uncategorised,14,
55,"Supply, installation and support of a secure and roaming printing solution including network laser printers, multifunction devices and related services for the AFP's new headquarters project",SON277786,Computer printers,Active,,ICT,Uncategorised,8,
56,Symantec Asia Pacific Head Agreement for the provision of Software and services,SON200069,Software,Active,,ICT,Uncategorised,30,
57,ICT Training Services Panel,SON210621,Education and Training Services,Active,,ICT,Uncategorised,19,
58,Technical Architecture Integration Services - Software,SON300097,Information technology consultation services,Active,,ICT,Uncategorised,17,
59,Technical Architecture Integration Services - Software,SON300090,Information technology consultation services,Active,,ICT,Uncategorised,17,
60,Learning and Development services panel,SON182930,Education and Training Services,Inactive,This panel was originally uploaded as 'active' because it was a mixed panel. However it has since been marked inactive by HF & SK (SK 11/04/2013),Uncategorised,Uncategorised,19,
61,Panel for provision of ICT products and associated services,SON169775,Communications Devices and Accessories,Active,,ICT,Uncategorised,7,
62,External Procurement Advisors Panel,SON161763,Management advisory services,Inactive,This panel was originally uploaded as 'active' because it was a mixed panel. However it has since been marked inactive by HF & SK (SK 11/04/2013),Uncategorised,Uncategorised,11,
63,Broadcast Engineering Services and Personnel,SON161930,Information technology consultation services,Inactive,This panel was originally uploaded as 'active' because it was a mixed panel. However it has since been marked inactive by HF & SK (SK 11/04/2013),Uncategorised,Uncategorised,13,
64,Deed of Standing Offer for purchase of desktop and portable PCs and maintenance services,SON160120,Desktop computers,Active,,ICT,Uncategorised,1,
65,Panel Arrangement to provide SAP Support Services,SON160262,Computer services,Active,,ICT,Uncategorised,18,
66,purchase of photocopiers,SON161801,Printer and photocopier and facsimile accessories,Active,,ICT,Uncategorised,8,
67,Assistance with the selection and recruitment of senior executive service and Executive level staff,SON169770,Personnel recruitment,Inactive,This panel was originally uploaded as 'active' because it was a mixed panel. However it has since been marked inactive by HF & SK (SK 11/04/2013),Uncategorised,Uncategorised,13,
68,Lease and Purchase of computer equipment and accessories.,SON254935,Computer Equipment and Accessories,Active,,ICT,Uncategorised,7,
69,Supply and management of digital recording media,SON150109,Media storage,Inactive,This panel was originally uploaded as 'active' because it was a mixed panel. However it has since been marked inactive by HF & SK (SK 11/04/2013),Uncategorised,Uncategorised,9,
70,External Service Provider and Project Management and Support Services Panel,SON155495,Project management,Inactive,This panel was originally uploaded as 'active' because it was a mixed panel. However it has since been marked inactive by HF & SK (SK 11/04/2013),Uncategorised,Uncategorised,52,
71,Management Consultancy Services Standing Offer Panel,SON167150,Management advisory services,Inactive,This panel was originally uploaded as 'active' because it was a mixed panel. However it has since been marked inactive by HF & SK (SK 11/04/2013),Uncategorised,Uncategorised,50,
72,Ageing and Aged Care Division's Data Warehouse (CASPER) Development Project.,SON187689,Information technology consultation services,Active,,ICT,Uncategorised,17,
73,Digital Receiver Conformance Testing Panel,SON301442,Components for information technology or broadcasting or telecommunications,Active,,Uncategorised,Uncategorised,40,
74,"The Provision of Stationery, Cut-Sheet Office Paper and Incidental IT Equipment and Software",SON63429,Stationery,Active,,Uncategorised,Uncategorised,7,
75,Supply and maintenance of Multi Functional Devices,SON41385,Photocopiers,Active,,ICT,Uncategorised,8,
76,Provision of Web Design and Development Services. Previously advertsied in GAPS ID 24844.,SON63852,World wide web WWW site design services,Active,,ICT,Uncategorised,17,
77,Simulation Support Services Standing Offer (SSSSO),SON162400,Computer based simulation training program services,Inactive,This panel was originally uploaded as 'active' because it was a mixed panel. However it has since been marked inactive by HF & SK (SK 11/04/2013),ICT,Uncategorised,19,
78,Head Agreement for the Provision of Microsoft Large Account Reseller Deliverables,SON211228,Software,Active,,Software,Microsoft,27,
79,Governance Services,SON241274,Management advisory services,Inactive,This panel was originally uploaded as 'active' because it was a mixed panel. However it has since been marked inactive by HF & SK (SK 11/04/2013),Uncategorised,Uncategorised,52,
80,Panel for Development of Corporate Support Systems,SON168417,Information Technology Broadcasting and Telecommunications,Active,,ICT,Uncategorised,17,
81,Provision of Consultancy Services,SON67304,Network applications software,Active,,ICT,Uncategorised,11,
82,Provision of a web based online recruitment system for the Department of Immigration and Citizenship,SON129146,Recruitment services,Active,,ICT,Uncategorised,25,
83,Panel for provision of application development services,SON131567,Software,Active,,ICT,Uncategorised,17,
84,Provision of Multi Function Devices and Printer Services to support Geoscience Australia's network envrionment,SON131873,Multifunction machines,Active,,ICT,Uncategorised,8,
85,Deed of Standing Offer for the Provision of Infrastucture Servers,SON137107,Computer servers,Active,,ICT,Uncategorised,14,
86,Business and Specialist Adviser Panel Arrangement,SON117492,Management advisory services,Inactive,This panel was originally uploaded as 'active' because it was a mixed panel. However it has since been marked inactive by HF & SK (SK 11/04/2013),Uncategorised,Uncategorised,11,
87,Supply of notebook computers (manual transfer of information from GAPS SO ID 20271),SON247,Notebook computers,Active,,ICT,Uncategorised,4,
88,For provision of a facial recognition solution,SON117411,Information Technology Broadcasting and Telecommunications,Active,,ICT,Uncategorised,30,
89,Provision of IT Security Servces,SON129796,Computer services,Active,,ICT,Uncategorised,15,
90,Panel of providers for the provision of eLearning Support Services and Solutions,SON142489,Education and Training Services,Active,,Uncategorised,Uncategorised,19,
91,"Provision of professional, technical and consultancy services to Defence Science & Technology Organisation.",SON38576,Professional engineering services,Inactive,This panel was originally uploaded as 'active' because it was a mixed panel. However it has since been marked inactive by HF & SK (SK 11/04/2013),Uncategorised,Uncategorised,11,
92,TRIM Training Services,SON222106,Education and Training Services,Active,,ICT,Uncategorised,19,
93,Provision of computing equipment to support Geoscience Australia's Windows/Linux Server Environment,SON169034,Computer servers,Active,,ICT,Uncategorised,5,
94,Storage Area Network hardware and related services,SON236594,Computer Equipment and Accessories,Active,,ICT,Uncategorised,9,
95,RFT for the supply of Scientific & Technical support services to the (BRS).,SON28856,Management and Business Professionals and Administrative Services,Inactive,This panel was originally uploaded as 'active' because it was a mixed panel. However it has since been marked inactive by HF & SK (SK 11/04/2013),Uncategorised,Uncategorised,11,
96,Software Services EMC Infra Pty Ltd NSW and Ingena Group Pty Ltd VIC,SON124837,Software,Active,,ICT,Uncategorised,47,
97,Deed of Standing Offer for the Provision of Services,SON139979,Information technology consultation services,Active,,ICT,Uncategorised,47,
98,Provision of applications development and support services. Previously advertised in GAPS 23366,SON58932,Application programming services,Active,,ICT,Uncategorised,17,
99,Project and engineering support services to the Department of Defence,SON194441,Professional engineering services,Inactive,This panel was originally uploaded as 'active' because it was a mixed panel. However it has since been marked inactive by HF & SK (SK 11/04/2013),Uncategorised,Uncategorised,53,
100,Project Support Services,SON72933,Human resources services,Inactive,This panel was originally uploaded as 'active' because it was a mixed panel. However it has since been marked inactive by HF & SK (SK 11/04/2013),Uncategorised,Uncategorised,13,
101,ICT People Services,SON34127,Temporary personnel services,Active,,ICT,Uncategorised,13,
102,Microsoft Master Services Agreement,SON34268,Office suite software,Active,,ICT,Uncategorised,27,
103,An expert panel to provide environmental health & related advice to the Commonwealth under Standing Offer Agreements,SON34769,Management and Business Professionals and Administrative Services,Inactive,This panel was originally uploaded as 'active' because it was a mixed panel. However it has since been marked inactive by HF & SK (SK 11/04/2013),Uncategorised,Uncategorised,11,
104,Selected IT Services,SON35586,Information technology consultation services,Active,,ICT,Uncategorised,15,
105,Provision of Information Technology Software,SON58560,Software,Active,,ICT,Uncategorised,28,
106,Software and Software Services Panel,SON68434,Software,Active,,Software,Uncategorised,28,
107,Panel for provision of information and communication technology services,SON85958,Computer services,Active,,IT Services,Uncategorised,47,
108,Provision of information communications and technology (ICT) and broadcasting services,SON94289,Communications Devices and Accessories,Active,,IT Services,Uncategorised,47,
109,"Maintenance, development and server hosting of the Monthly Publishing System",SON95160,Information Technology Broadcasting and Telecommunications,Active,,ICT,Uncategorised,17,
110,Provision of Contract/Consulting IT Audit Services,SON137116,Audit services,Active,,ICT,Uncategorised,11,
111,E-Learning System,SON239610,Education and Training Services,Active,,ICT,Uncategorised,48,
112,Services for the delivery of a platform refresh and upgrade to the ABR Business Name Register,SON260073,Application implementation services,Active,,IT Services,SI Services,17,
114,Provision of software and software support services,SON98767,Software,Active,,ICT,Uncategorised,28,
115,Provision of Hardware and Services to Support Geoscience Australia's Core Network Infrastructure,SON113536,Information Technology Broadcasting and Telecommunications,Active,,ICT,Uncategorised,7,
116,Provision of hardware and services to support Geoscience Australia's Sun Unix environment,SON169039,Computer servers,Active,,ICT,Uncategorised,5,
117,Provision Of IT Personnel,SON26578,Management support services,Active,,IT Services,Uncategorised,13,
118,Change Management Services,SON299989,Information technology consultation services,Active,,ICT,Uncategorised,11,
119,Network Infrastructure Panel,SON68428,Components for information technology or broadcasting or telecommunications,Active,,IT Services,Uncategorised,6,
120,Supply of WAN accelerators and related services,SON87838,Computer services,Active,,ICT,Uncategorised,6,
121,Supply of Edge Lan switches and related services,SON94453,Computer Equipment and Accessories,Active,,ICT,Uncategorised,6,
122,"Provision of Tape Library, Drives and Media for the Family Court",SON290439,Data Voice or Multimedia Network Equipment or Platforms and Accessories,Active,,ICT,Uncategorised,9,
123,Siebel Application Development Panel,SON90049,Software,Active,,ICT,Uncategorised,17,
124,Provision of Photocopiers and Multi Function Devices,SON73427,Office machines and their supplies and accessories,Active,,ICT,Uncategorised,8,
125,General Consultancy Services Panel,SON67861,Business and corporate management consultation services,Inactive,This panel was originally uploaded as 'active' because it was a mixed panel. However it has since been marked inactive by HF & SK (SK 11/04/2013),Uncategorised,Uncategorised,11,
126,"Standing Offer for the Supply, Configuration and Warranty of Destop and Notebook Computers, Servers and Printers (IT Hardware)",SON106896,Computer Equipment and Accessories,Active,,ICT,Uncategorised,46,
127,Project Support Services,SON72937,Human resources services,Active,,ICT,Uncategorised,13,
128,Standing Offer for the Supply of Network Equipment and Associated Services,SON183464,Computer Equipment and Accessories,Active,,ICT,Uncategorised,6,
129,Provision of Select Recruitment Services,SON35,Human resources services,Inactive,This panel was originally uploaded as 'active' because it was a mixed panel. However it has since been marked inactive by HF & SK (SK 11/04/2013),Uncategorised,Uncategorised,13,
130,Panel of Non Ongoing Employees and Contract Staff for FaHCSIA,SON68225,Human resources services,Inactive,This panel was originally uploaded as 'active' because it was a mixed panel. However it has since been marked inactive by HF & SK (SK 11/04/2013),Uncategorised,Uncategorised,13,
131,Computer storage equipment and services.,SON235434,Computer Equipment and Accessories,Active,,ICT,Uncategorised,9,
132,Standing Offer for the Supply of Server Infrastructure and Associated Services,SON183429,Computer Equipment and Accessories,Active,,ICT,Uncategorised,5,
133,Technical Architecture and Audit Services,SON300099,Information technology consultation services,Active,,ICT,Uncategorised,47,
134,JP2077 Phase 2 Support to Functional - Project Management and Program Management Office Services,SON300912,Information technology consultation services,Active,,ICT,Uncategorised,11,
135,Strategic Change Consultancy Services,SON67014,Management advisory services,Inactive,This panel was originally uploaded as 'active' because it was a mixed panel. However it has since been marked inactive by HF & SK (SK 11/04/2013),Uncategorised,Uncategorised,11,
136,"The development, integration and support of command support systems for Joint Project 2030 Phase 8 (JP2030PH8) Joint Command Support Environment (JCSE).",SON272554,Software or hardware engineering,Active,,ICT,Uncategorised,47,
137,Supply and maintenance of desktop personal computers,SON67637,Information Technology Broadcasting and Telecommunications,Active,,ICT,Uncategorised,1,
138,"Provision of Sun Microsystems software, hardware and professional services",SON66160,Computer Equipment and Accessories,Active,,ICT,Uncategorised,47,
139,Provision of training services,SON67493,Education and Training Services,Inactive,This panel was originally uploaded as 'active' because it was a mixed panel. However it has since been marked inactive by HF & SK (SK 11/04/2013),Uncategorised,Uncategorised,19,
140,Provision of Contract Labour,SON64674,Temporary personnel services,Inactive,This panel was originally uploaded as 'active' because it was a mixed panel. However it has since been marked inactive by HF & SK (SK 11/04/2013),Uncategorised,Uncategorised,13,
