IdSon,Description,sonid,AustenderCategory,Status,internalcomment,ContractProcessingCategory,ContractProcessingSubCategory,IdCat,Title
3297,"Air Transport Deed of Standing Offer. This Standing Offer is for the transport of Australian Defence Force personnel, equipment and cargo by air, domestically and internationally over a period of three years with two one year extensions at the discretion of the Department. The Department has extended the Deed for 12 months - till 1 November 2013.",SON179438,Transport operations,Inactive,,Non-ICT,Non-ICT,53,
3298,Defence Infrastructure Panel 2010,SON248776,Building construction and support and maintenance and repair services,Inactive,Date updated from 20/01/2014 to 17/01/2017 (SK 12/03/2014),Non-ICT,Non-ICT,53,
3299,Supply of Ceremonial Swords and Accessories,SON246646,Knife blades,Inactive,,Non-ICT,Non-ICT,53,
3300,Electromagnetic Environmental Effects Testing and Design Services,SON244327,Aircraft equipment,Inactive,,Non-ICT,Non-ICT,53,
3301,Supply of Milk and Dairy Products to Defence establishments in South East Queensland,SON242318,Dairy products and eggs,Inactive,,Non-ICT,Non-ICT,53,
3302,Industry Support for Countermeasures Development and Validation and other Electronic Warfare Requirements,SON238177,Military science and research,Inactive,,Non-ICT,Non-ICT,53,
3303,Industry Support for Countermeasures Development and Validation and other Electronic Warfare Requirements,SON238172,Military science and research,Inactive,,Non-ICT,Non-ICT,53,
3304,Furniture Hire,SON233148,Furniture,Inactive,,Non-ICT,Non-ICT,53,
3305,"Provision of Services for Storage of AHS Records, Information and Other Media",SON208008,Specialised warehousing and storage,Inactive,,Non-ICT,Non-ICT,53,
3306,"The Road Transport Deed of Standing Offer covers the movement by road or combination of road and rail (at the contractor's discretion) of equipment and/or cargo for operational, training or testing movements. This Standing Offer is open to all Commonwealth Departments. The Panel operates for a period of 3 years (till 30 May 2012) with two possible 1 year extensions.",SON207731,Transport operations,Inactive,,Non-ICT,Non-ICT,53,
3307,Provision of sanitary disposal units to the Royal Australian Navy,SON197467,Sanitary waste receptacles,Inactive,,Non-ICT,Non-ICT,53,
3308,Provision of Source Data Duplication Bureau Services,SON196977,Electronic media or data duplicating equipment,Inactive,,Non-ICT,Non-ICT,53,
3309,"Provide Bread and Bread Products to Ration Store, RAAF Base Amberley for messes and inflights kitchen.",SON196399,Bread and bakery products,Inactive,,Non-ICT,Non-ICT,53,
3310,Instructor Support Services,SON189380,Education and Training Services,Inactive,,Non-ICT,Non-ICT,53,
3311,Grocery Items,SON185956,Food and Beverage Products,Inactive,,Non-ICT,Non-ICT,53,
3312,Fruit and Vegetables,SON173401,Food and Beverage Products,Inactive,,Non-ICT,Non-ICT,53,
3313,Supply of Groceries to the Australian Defence Force (ADF)  in Rockhampton,SON169912,Food and Beverage Products,Inactive,,Non-ICT,Non-ICT,53,
3314,Provide testing and tagging services of portable electrical equipment at various Defence establishments,SON167311,Electrical services,Inactive,Date changed from 31 Mar 2014 to 31 Mar 2015,Non-ICT,Non-ICT,53,
3315,Commercial Delivery of Driver Training to Army Logistics Training Centre,SON167306,Education and Training Services,Inactive,,Non-ICT,Non-ICT,53,
3316,"Provision of skilled and experienced specialist labour, on a Standing Offer basis, for the maintenance of airborne and ground technical equipment and associated equipment at Australian Defence Force (ADF) locations in Australia.",SON157828,Military services and national defence,Inactive,,Non-ICT,Non-ICT,53,
3317,Environmental Management and Heritage related services,SON153695,Environmental management,Inactive,,Non-ICT,Non-ICT,53,
3318,Media Support Services for Defence Force Recruiting,SON981411,Public relation services,Inactive,ATM ID: DFR/ATM/2012/003-MSS,Non-ICT,Non-ICT,53,
3319,Provision of Engineering Services,SON879711,Professional engineering services,Inactive,,Non-ICT,Non-ICT,53,
3320,Electronic Information Resources and Related Services,SON839071,Electronic reference material,Inactive,ATM ID: RFT DLS 1/2011,Non-ICT,Non-ICT,53,
3321,Establishment of Language Services Standing Offer Panel to the Department of Defence Defence School of Languages,SON706091,Education and Training Services,Inactive,,Non-ICT,Non-ICT,53,
3322,Provision of Office Supplies,SON639231,Stationery,Inactive,,Non-ICT,Non-ICT,53,
3323,Vehicle and ground support equipment maintenance services,SON574652,Vehicle servicing equipment,Inactive,,Non-ICT,Non-ICT,53,
3324,Workplace Laboratory Analysis and Occupational Health and Safety Services,SON526202,Occupational health or safety services,Inactive,,Non-ICT,Non-ICT,53,
3325,Provision of Probity Adviser Services,SON483342,Professional procurement services,Inactive,,Non-ICT,Non-ICT,53,
3326,Rotary wing air transport service from Darwin to Bathurst Island (return),SON475272,Passenger air transportation,Inactive,,Non-ICT,Non-ICT,53,
3327,Supply physical fitness and recreational equipment,SON463909,Sports equipment and accessories,Inactive,,Non-ICT,Non-ICT,53,
3328,Standing offer for the provision of employee assistance services.,SON451220,Psychologists services,Inactive,,Non-ICT,Non-ICT,53,
3329,"Supply accommodation furniture, dining furniture, whitegoods and other household appliances",SON452911,Furniture,Inactive,,Non-ICT,Non-ICT,53,
3330,Supply Business Cards,SON450600,Printing,Inactive,,Non-ICT,Non-ICT,53,
3331,Standing Offer Panel for the provision of a range of simulation support services.,SON444305,Professional engineering services,Inactive,ATM ID: JOC/1415/005,Non-ICT,Non-ICT,53,
3332,"Supply of Naval Port Agency Services (SONPAS) to Royal Australian Navy units around the world, excluding Middle Eastern Ports",SON431245,Management support services,Inactive,Date changed from 02 Jun 2014 to 01 Jun 2015,Non-ICT,Non-ICT,53,
3333,"Technical, Project Maagement and Documentation Services",SON430051,Project management,Inactive,,Non-ICT,Non-ICT,53,
3334,Provision of Rotary Wing Aero Medical Evacuation Services to Army in remote parts of Australia,SON426148,Healthcare provider support persons,Inactive,,Non-ICT,Non-ICT,53,
3335,Injury management services for APS employees,SON419619,Rehabilitation services,Inactive,,Non-ICT,Non-ICT,53,
3336,Provision of Role Player Support for Defence Intelligence Training Centre (DIntTC) and Defence Police Training Centre (DPTC).,SON415243,Education and Training Services,Inactive,,Non-ICT,Non-ICT,53,
3337,Provision of Office Supplies to various Defence establishments,SON408921,Office supplies,Inactive,,Non-ICT,Non-ICT,53,
3338,Recording and Transcription Services,SON407366,Transcribing services,Inactive,ATM ID: DLD001/2010,Non-ICT,Non-ICT,53,
3339,Extension to WARS 2006 Standing Offer for Supply of fresh rations to HMA ships and submarines and various Army Units,SON401372,Food and Beverage Products,Inactive,,Non-ICT,Non-ICT,53,
3340,Patent Attorney Services,SON395071,Management advisory services,Inactive,,Non-ICT,Non-ICT,53,
3341,Provision of Occupational Health and Safety Services,SON389491,Occupational health or safety services,Inactive,,Non-ICT,Non-ICT,53,
3342,Supply electricity to Commonwealth Government agencies in ACT,SON387299,Utilities,Inactive,Date updated from 30/06/2015 to 30/06/2016 (SK 12/03/2014),Non-ICT,Non-ICT,53,
3343,Supply office furniture to various Defence establishments,SON386586,Office furniture,Inactive,Date changed from 31 Mar 2014 to 31 Mar 2015,Non-ICT,Non-ICT,53,
3344,Provision of specialist policy advice and undertaking complex project tasks in support of Audit & Fraud Control Division business requirements.,SON374177,Management support services,Inactive,,Non-ICT,Non-ICT,53,
3345,Provision of Specialist Motorcycle Safety Awareness Training,SON359151,Motorcycles,Inactive,,Non-ICT,Non-ICT,53,
3346,Vetting Case Services,SON1160012,Business administration services,Inactive,,Non-ICT,Non-ICT,53,
3347,Provision of Aeromedical Evacuation Support to the Australian Army,SON1154112,Medical practice,Inactive,,Non-ICT,Non-ICT,53,
3348,GEERS Contracting Panel,SON348660,Public administration and finance services,Inactive,,Non-ICT,Non-ICT,53,
3349,2010-15 Accounting and auditing panel,SON344817,Accounting services,Inactive,,Uncategorised,Uncategorised,53,
3350,Relocation Services,SON317700,Relocation services,Inactive,,Non-ICT,Non-ICT,53,
3351,Procurement of Facilitators for the Australian Youth Forum and other Youth Initiatives,SON317627,Project administration or planning,Inactive,,Non-ICT,Non-ICT,53,
3352,Panel Arrangement Services for Quality Assurance of Workplace English Language and Literacy (WELL) Program Resource Projects,SON317626,Management support services,Inactive,,Non-ICT,Non-ICT,53,
3353,Indigeneous Employment Panel,SON310360,Community and social services,Inactive,,Non-ICT,Non-ICT,53,
3354,Actuarial Services Panel Arrangement,SON302737,Development finance,Inactive,,Non-ICT,Non-ICT,53,
3355,2009-2011 Endeavour Awards Selection Panel Services,SON299966,Project administration or planning,Inactive,,Non-ICT,Non-ICT,53,
3356,The provision of legal advice,SON288091,Legal services,Inactive,,Non-ICT,Non-ICT,53,
3357,Panel of Assessors for the delivery of Ongoing Support Assessments and Supported Wage System,SON274099,Community and social services,Inactive,,Non-ICT,Non-ICT,53,
3358,Provision of Editorial and Writing Services,SON180038,Editorial and support services,Inactive,,Non-ICT,Non-ICT,53,
3359,Provision of Remuneration Salary Packaging Services to staff,SON170936,Management and Business Professionals and Administrative Services,Inactive,,Non-ICT,Non-ICT,53,
3360,"Research, Evaluation and Analysis Panel (REAP):    - Data Collection sub-panel    - Data Analysis sub-panel    - Qualitative Research sub-panel",SON164072,Research programs,Inactive,,Non-ICT,Non-ICT,53,
3361,Procurement of Facilitators for the Australian Youth Forum and other youth initiatives,SON935931,Project administration or planning,Inactive,,Non-ICT,Non-ICT,53,
3362,Supply of Light Globes for DEEWR National Office,SON822471,Electrical equipment and components and supplies,Inactive,,Non-ICT,Non-ICT,53,
3363,"The Employment Panel will equip employers with the skills, knowledge and expertise necessary to provide sustainable opportunities and will prepare Indigenous Australians to take up employment opportunities, stay in jobs and enhance their future employment",SON838311,Community and social services,Inactive,,Non-ICT,Non-ICT,53,
3364,"The Economic Development and Business Support Panel will support enterprises through strategies and services for building economic and business development opportunities, provide activities that support the development of viable businesses and assist with financial strategies or services for Indigenous business organisations",SON838301,Community and social services,Inactive,,Non-ICT,Non-ICT,53,
3365,DEEWR Learning and Development Panel,SON727001,Education and Training Services,Inactive,,Non-ICT,Non-ICT,53,
3366,Supply and installation of signage for National office,SON509452,Signage and accessories,Inactive,,Non-ICT,Non-ICT,53,
3367,360 Degree Survey feedback services,SON483872,Management support services,Inactive,,Non-ICT,Non-ICT,53,
3368,Panel for the construction and refurbishment of selected child care centres,SON469227,Building construction and support and maintenance and repair services,Inactive,,Non-ICT,Non-ICT,53,
3369,National office fitout panel,SON453560,Building support services,Inactive,,Non-ICT,Non-ICT,53,
3370,Panel for hotel accomodation,SON446908,Hotels and motels and inns,Inactive,,Non-ICT,Non-ICT,53,
3371,Employment based teacher education training program,SON446225,Education and Training Services,Inactive,,Non-ICT,Non-ICT,53,
3372,Commercial Information Reports Panel,SON446220,Credit agencies,Inactive,,Non-ICT,Non-ICT,53,
3373,"Courses to develop knowledge and skills in public policy, economics and demography, Indigenous Australia and innovation strategy",SON445247,Education and Training Services,Inactive,,Non-ICT,Non-ICT,53,
3374,The provision of property fitout supply and delivery of loose furniture,SON440966,Office furniture,Inactive,,Non-ICT,Non-ICT,53,
3375,"Records storage, sentencing and destruction of Commonwealth records",SON378487,File archive storage,Inactive,,Non-ICT,Non-ICT,53,
3376,Contact centre operations services,SON374329,Management support services,Inactive,,Non-ICT,Non-ICT,53,
3377,Panel arrangement for quality assurance in the development of training packages,SON359521,Management advisory services,Inactive,,Non-ICT,Non-ICT,53,
3378,Provision of closed circuit television equipment,SON359519,Network security equipment,Inactive,,Non-ICT,Non-ICT,53,
3379,Legal Services,SON200,Legal services,Inactive,,Non-ICT,Non-ICT,53,
3380,ORIC Regulatory Panel,SON133409,Business administration services,Inactive,,Non-ICT,Non-ICT,53,
3381,Internal Audit and Fraud Services,SON90044,Internal audits,Inactive,,Non-ICT,Non-ICT,53,
3382,Project Advisory & Management Services in Support of Indigenous Housing & Infrastructure Programs Panel,SON78748,Management advisory services,Inactive,,Non-ICT,Non-ICT,53,
3383,Gender Experts Panel,SON337892,Research programs,Inactive,,Non-ICT,Non-ICT,53,
3384,"Participatory Planning, Research, Evaluation & Training Panel",SON319744,Community and social services,Inactive,,Non-ICT,Non-ICT,53,
3385,Electrical Services for remote NT communities,SON321392,Electrical services,Inactive,,Non-ICT,Non-ICT,53,
3386,Electrical services in Remote NT communities,SON321373,Electrical services,Inactive,,Non-ICT,Non-ICT,53,
3387,Construction and Maintenance Services for Accomodation Units in the NT,SON315284,Building construction and support and maintenance and repair services,Inactive,,Non-ICT,Non-ICT,53,
3388,Pest Control Services for Accommondation Units.,SON324354,Pest control,Inactive,,Non-ICT,Non-ICT,53,
3389,Pest Control Services for Accommodation Units,SON323814,Pest control,Inactive,,Non-ICT,Non-ICT,53,
3390,Construction and Maintenance Services for Accommodation Units,SON321242,Building construction and support and maintenance and repair services,Inactive,Date updated from 30/06/2015 to 30/06/2013 (SK 12/03/2014),Non-ICT,Non-ICT,53,
3391,Fire Safety related services in relation to construction and maintenance services for accommodation units.,SON319774,Property management services,Inactive,,Non-ICT,Non-ICT,53,
3392,Electrical Services in remote NT communities,SON321366,Electrical services,Inactive,,Non-ICT,Non-ICT,53,
3393,"RSD - Supply, delivery & installation of modular accommodation",SON292617,General building construction,Inactive,,Non-ICT,Non-ICT,53,
3394,Housing Panel,SON280441,Economics,Inactive,,Non-ICT,Non-ICT,53,
3395,"An Australia-wide register of suitably qualified training providers with demonstrated experience and capability to deliver corporate governance training to Indigenous corporations in urban, regional and remote areas",SON266578,Education and Training Services,Inactive,,Non-ICT,Non-ICT,53,
3396,Provision of Workstation Assessments for FaHCSIA Staff,SON270024,Workstations and office packages,Inactive,,Non-ICT,Non-ICT,53,
3397,Panel to Provide Probity Advice and Probity Audit services.,SON254424,Management advisory services,Inactive,,Non-ICT,Non-ICT,53,
3398,Indigenous Program Panel 3: Organisational & Operational Management Advisers,SON209520,Business administration services,Inactive,,Non-ICT,Non-ICT,53,
3399,Indigenous Program Panel 2: Financial Management Advisers,SON209497,Business administration services,Inactive,,Non-ICT,Non-ICT,53,
3400,Indigenous Program Panel 1: Native Title & Land Rights Service Providers,SON209467,Legal services,Inactive,,Non-ICT,Non-ICT,53,
3401,Printing and Promotional Products Panel,SON206666,Promotional or advertising printing,Inactive,,Non-ICT,Non-ICT,53,
3402,Indigenous Community Leadership Program panel,SON176683,Management advisory services,Inactive,,Non-ICT,Non-ICT,53,
3403,"Workstation, chairs and loose furniture nationally supply and installation",SON881711,Office furniture,Inactive,,Non-ICT,Non-ICT,53,
3404,Training and Other Services under FMP and HESP,SON618871,Education and Training Services,Inactive,,Non-ICT,Non-ICT,53,
3405,Cadastral Survey & Associated Survey Services in Remote Communities NT,SON471597,Mapping,Inactive,,Non-ICT,Non-ICT,53,
3406,"Development, maintenance and support for STINMOD microsimulation",SON462257,Research programs,Inactive,,Non-ICT,Non-ICT,53,
3407,Social Policy Research and Evaluation Services,SON456233,Research programs,Inactive,,Non-ICT,Non-ICT,53,
3408,Senior Executive Search (SES) and Recruitment Services Panel,SON397085,Personnel recruitment,Inactive,,Non-ICT,Non-ICT,53,
3409,Panel for provision of Environmental Management Services,SON381485,Environmental management,Inactive,,Non-ICT,Non-ICT,53,
3410,Removal Services,SON378581,Relocation services,Inactive,,Non-ICT,Non-ICT,53,
3411,Pest Control Services - NT Southern Region,SON359828,Pest control,Inactive,,Non-ICT,Non-ICT,53,
3412,Locksmith Services for Accommodation Units,SON359522,Building construction and support and maintenance and repair services,Inactive,,Non-ICT,Non-ICT,53,
3413,Salary Packaging,SON352545,Business administration services,Inactive,,Non-ICT,Non-ICT,53,
3414,Legal Services parcelling arrangements - Whole of Government Arrangement.,SON1135042,Legal services,Inactive,,Non-ICT,Non-ICT,53,
3415,Fleet Management Agreement Contract for the provision of motor vehicle fleet management and leasing services to Australian Government departments and agencies.,SON27006,Fleet management services,Inactive,,Non-ICT,Non-ICT,53,
3416,Panel of Hire Car Contractors,SON168,Automobiles or cars,Inactive,,Non-ICT,Non-ICT,53,
3417,"The Actuarial Services panel has been established to allow Australian Government entities to readily access actuarial services from panel members, up to the value of $80,000 per task.  The Department of Finance and Deregulation is administering the panel and can be contacted for further information on utlilising it.",SON146959,Development finance,Inactive,,Non-ICT,Non-ICT,53,
3418,"Learning and Development Services including training, facilitation and executive coaching.",SON107219,Education and Training Services,Inactive,,Non-ICT,Non-ICT,53,
3419,Coach Services to COMCAR,SON85993,Passenger road transportation,Inactive,,Non-ICT,Non-ICT,53,
3420,Accountancy and Business Advice Services Panel,SON57177,Accounting services,Inactive,,Non-ICT,Non-ICT,53,
3421,Whole of Australian Government International Air Services,SON289581,Travel facilitation,Inactive,,Non-ICT,Non-ICT,53,
3422,Whole of Australian Government Domestic Air Services,SON288795,Travel facilitation,Inactive,,Non-ICT,Non-ICT,53,
3423,Whole of Australian Government Travel Management Services,SON289574,Travel facilitation,Inactive,,Non-ICT,Non-ICT,53,
3424,Provision of Salary Packaging Services,SON286538,Human resources services,Inactive,,Non-ICT,Non-ICT,53,
3425,Licence Deed to develop and deliver financial mangement and budgeting training to Australian Public Sector (APS) staff and other interested parties,SON265938,Education and Training Services,Inactive,,Non-ICT,Non-ICT,53,
3426,"Licence rights to Publish, Distribute and Promote the Style Manual for Authors, Editors and Printers, 6th Edition.",SON265910,Printed media,Inactive,,Non-ICT,Non-ICT,53,
3427,P3M3 Maturity Assessment Consultancy Services Panel,SON265819,Management advisory services,Inactive,,Non-ICT,Non-ICT,53,
3428,Provision of Handyman Services (Panel),SON216555,Building construction and support and maintenance and repair services,Inactive,,Non-ICT,Non-ICT,53,
3429,Master Media Agency for Planning and Placement of Campaign Advertising for the Commonwealth of Australia (mandatory for all agencies under the Financial Management and Accountability Act 1997 (FMA Act)),SON194870,Advertising,Inactive,,Non-ICT,Non-ICT,53,
3430,Provision of Flags under the Constituents' Request Program,SON193451,Fibres and textiles and fabric industries,Inactive,,Non-ICT,Non-ICT,53,
3431,Deed of Standing Offer for the Provision of Legal Services (Panel),SON187784,Legal services,Inactive,,Non-ICT,Non-ICT,53,
3432,"Master Media Agency for Placement of Non-Campaign Advertising for the Commonwealth of Australia (mandatory for all agencies under the Financial Management and Accountability Act 1997 (FMA Act), optional for agencies under the Commonwealth Authorities and Companies Act 1997 (CAC Act))",SON182272,Advertising,Inactive,,Non-ICT,Non-ICT,53,
3433,"Standing offer for supply of height adjustable office chairs, visitor';s chairs and conference room chairs.",SON181473,Office furniture,Inactive,,Non-ICT,Non-ICT,53,
3434,Request for Tender for Appointment of a Learning and Development Panel of Service Providers,SON873641,Education and Training Services,Inactive,ATM ID: FIN11/COO013,Non-ICT,Non-ICT,53,
3435,Accommodation Program Management Services to the Australian Government,SON590021,Hotels and motels and inns,Inactive,,Non-ICT,Non-ICT,53,
3436,Car Rental Services to the Australian Government,SON590091,Vehicle rental,Inactive,,Non-ICT,Non-ICT,53,
3437,Travel and Related Card Services to the Australian Government,SON688231,Credit card service providers,Inactive,ATM ID: FIN11/FMG018,Non-ICT,Non-ICT,53,
3438,"Heritage, Environment and Sustainability Services Panel",SON639101,Environmental management,Inactive,ATM ID: FIN11/AMPS013A,Non-ICT,Non-ICT,53,
3439,Whole of Government (WoG) Stationery and Office Supplies (SOS) Panel Arrangement,SON473022,Stationery,Inactive,,Non-ICT,Non-ICT,53,
3440,Deed of Standing Offer for the Provision of Research Services on media consumption and information preferences for Indigenous audiences,SON457700,Market research,Inactive,,Non-ICT,Non-ICT,53,
3441,Deed of Standing Offer for the Provision of Research Services on media consumption and information preferences for multicultural audiences,SON457699,Market research,Inactive,,Non-ICT,Non-ICT,53,
3442,Provision of educational service providers for the Australian Public Service (APS) Information and Communications Technology (ICT) Entry-level Programs,SON436224,Education and Training Services,Inactive,,Non-ICT,Non-ICT,53,
3443,Deed of Standing Offer for the provision of financial market consultancy services  for advice on the investments of the Commonwealth's financial asset funds,SON371512,Management advisory services,Inactive,Date updated from 11/03/2014 to 10/03/2015 (SK 12/03/2014),Non-ICT,Non-ICT,53,
3444,Provision of Hire Cars (Chauffeur Driven) Services to COMCAR,SON368377,Passenger road transportation,Inactive,,Non-ICT,Non-ICT,53,
3445,Provision of Vehicle Fleet Management and Leasing Services to the Australian Government,SON1142512,Fleet management services,Inactive,,Non-ICT,Non-ICT,53,
3446,Information Services Personnel Panel.,SON470144,Human resources services,Inactive,,Uncategorised,Uncategorised,53,
3447,Provision of Security Clearance Processing,SON132836,Business administration services,Inactive,,Non-ICT,Non-ICT,53,
3448,Physical Security Fit Out Panel,SON112037,Structural materials and basic shapes,Inactive,,Non-ICT,Non-ICT,53,
3449,Overseas Property Office Panel,SON81566,Management advisory services,Inactive,,Non-ICT,Non-ICT,53,
3450,Provision of Security Clearance Processing Services,SON71413,Business administration services,Inactive,,Non-ICT,Non-ICT,53,
3451,Accommodation Support Services for the R. G. Casey Building,SON353951,Building support services,Inactive,,Non-ICT,Non-ICT,53,
3452,Provision of Security Hardware,SON341001,Locks and security hardware and accessories,Inactive,,Non-ICT,Non-ICT,53,
3453,Provision of Endorsed Combination Locks,SON341000,Locks and security hardware and accessories,Inactive,,Non-ICT,Non-ICT,53,
3454,Provision of Food Catering Services for Official Functions,SON234421,Banquet and catering services,Inactive,,Non-ICT,Non-ICT,53,
3455,Publication Services Panel,SON206281,Publishing,Inactive,,Non-ICT,Non-ICT,53,
3456,Provision of security and personal safety,SON726861,Security and personal safety,Inactive,ATM ID: DFAT11-OPO-15,Non-ICT,Non-ICT,53,
3457,Provision of armoured commercial vehicles.,SON450841,Safety and rescue vehicles,Inactive,ATM ID: DFAT10-CMD-26,Non-ICT,Non-ICT,53,
3458,Language Training Services,SON447559,Education and Training Services,Inactive,,Non-ICT,Non-ICT,53,
3459,Training Delivery and Development,SON416153,Education and Training Services,Inactive,,Non-ICT,Non-ICT,53,
3460,Supply of Office Chairs to the Department of Foreign Affairs and Trade,SON384477,Furniture,Inactive,,Non-ICT,Non-ICT,53,
3461,"Vehicle Knowledge and Driver Skills Training Programs for Discreetly Armoured Vehicles - Asian, African and Middle East Regions",SON368542,Security and personal safety,Inactive,,Non-ICT,Non-ICT,53,
3462,Provision of Business Administration Services (Construction and Trades) panel,SON1163722,Business administration services,Inactive,,Non-ICT,Non-ICT,53,
3463,Provision of national distribution services for ministerial and departmental news releases,SON89984,Management and Business Professionals and Administrative Services,Inactive,,Non-ICT,Non-ICT,53,
3464,Public relations services for the National Drugs Campaign (Phase Five),SON348704,Public relation services,Inactive,,Non-ICT,Non-ICT,53,
3465,National Partnership Agreement on Preventative Health - Phase Two Measure Up Social Marketing Campaign creative services,SON345470,Public relation services,Inactive,,Non-ICT,Non-ICT,53,
3466,Public relations services for the National Partnership Agreement on Preventive Health (NPAPH) Tobacco Social Marketing Campaign,SON345469,Public relation services,Inactive,,Non-ICT,Non-ICT,53,
