IdSon,Description,sonid,AustenderCategory,Status,internalcomment,ContractProcessingCategory,ContractProcessingSubCategory,IdCat,Title
4608,Military Integrated Logistics Information &  other Ventyx applications,SON3198412,Management information systems MIS,Active,,Software,Business systems,21,
4609,Interpreting and translation services,SON3026592,Interpreters,Inactive,,Non-ICT,Non-ICT,52,
4610,"Hand Tools, Containers and Automated Tool Management System",SON3191312,Tools and General Machinery,Inactive,,Uncategorised,Uncategorised,52,
4611,Panel of Assessors for the delivery of Ongoing Support Assessments,SON3189542,Community and social services,Inactive,ATM ID: NPA-10-11002,Non-ICT,Non-ICT,52,
4612,"Records, It Media, Storage, Disposal and Digitisation Services",SON3184252,Document storage services,Inactive,,Uncategorised,Uncategorised,52,
4613,Provision of Disposal Agent Services,SON3181952,Management advisory services,Inactive,,Non-ICT,Non-ICT,52,
4621,Provision of Valuation & Valuation Related Services,SON3206842,Business intelligence consulting services,Inactive,,Non-ICT,Non-ICT,52,
4622,Provision of Managed Print Rooms and Evidence Processing Services,SON3227202,Printing,Inactive,,Non-ICT,Non-ICT,52,
4623,Provision of a Deployment and Release Management Solution,SON3217062,Software,Active,,Software,Operating,29,
4624,Consultancy and Business Services,SON3216612,Management advisory services,Inactive,,Non-ICT,Non-ICT,52,
4625,"Medico-Legal Assessments, Reporting and Litigation Support Services",SON3204922,Comprehensive health services,Inactive,,Non-ICT,Non-ICT,52,
4626,"Print, shrink wrap and deliver certified lists for an federal election even",SON3203852,Printing,Inactive,,Non-ICT,Non-ICT,52,
4628,Salary Packaging Services,SON3248672,Human resources services,Inactive,,Non-ICT,Non-ICT,52,
4629,Provision of Financial Assesement and Monitoring Services,SON3248482,Accounting services,Inactive,,Non-ICT,Non-ICT,52,
4630,Port Agency Services for Royal Australian Navy vessels,SON3232552,Military watercraft,Inactive,,Non-ICT,Non-ICT,52,
4631,"Provision of Records, IT Media, Storage, Sentencing, Disposal and Digitisat",SON3273292,Document storage services,Inactive,,Uncategorised,Uncategorised,52,
4632,Software licensing and support services,SON3269542,Software maintenance and support,Active,,Software,Business Systems,21,
4633,Specialised services to assist the Department,SON3194822,Business administration services,Active,,IT services,Business Consulting,11,
4634,Supply of Pharmaceuticals to the ADF,SON3263602,Drugs and Pharmaceutical Products,Inactive,,Non-ICT,Non-ICT,52,
4635,Ground Support Equipment Maintenance Services,SON3261532,Vehicle maintenance and repair services,Inactive,,Non-ICT,Non-ICT,52,
4636,Provision of Waveguide Parts,SON3261382,Measuring and observing and testing instruments,Inactive,,Non-ICT,Non-ICT,52,
4637,Support to Implementation of First Principles Review,SON3250352,Management advisory services,Inactive,,Uncategorised,Uncategorised,52,
4638,Waste disposal services,SON3278736,Hazardous waste disposal,Inactive,,Non-ICT,Non-ICT,52,
4639,Profiling Floats,SON3009842,Laboratory and scientific equipment,Inactive,,Non-ICT,Non-ICT,52,
4640,Provision of Fresh Fruit and Vegetables to the ADF - Perth,SON3278514,Food and Beverage Products,Inactive,,Non-ICT,Non-ICT,52,
4641,Furniture and equipment hire,SON3278507,Furniture,Inactive,,Non-ICT,Non-ICT,52,
4642,Standing Offer Panel for WHS Auditing Services,SON3277625,Occupational health or safety services,Inactive,,Non-ICT,Non-ICT,52,
4643,ICT Professional Services - Treasury Portfolio,SON3280319,Information technology consultation services,Active,,IT Services,Uncategorised,17,
4644,Provision of Fresh Fruit and Vegetables to the ADF - Adelaide,SON3280671,Food and Beverage Products,Inactive,,Non-ICT,Non-ICT,52,
4645,Electromagnetic Environmental Effects Training,SON3096802,Education and Training Services,Inactive,,Non-ICT,Non-ICT,52,
4646,"Provision of Dairy Products to Navy - Darwin, Cairns &  Townsville",SON3283023,Food and Beverage Products,Inactive,,Non-ICT,Non-ICT,52,
4647,Provision of Bakery Products to Army - Darwin,SON3283007,Food and Beverage Products,Inactive,,Non-ICT,Non-ICT,52,
4648,Provision of Bakery Products to Navy - Darwin,SON3283000,Food and Beverage Products,Inactive,,Non-ICT,Non-ICT,52,
4649,Interpreter and Translation Services,SON3282632,Interpreters,Inactive,,Non-ICT,Non-ICT,52,
4650,"Swords, Accessories and Refurbishment",SON3282623,Uniforms,Inactive,,Non-ICT,Non-ICT,52,
4651,PACTAM,SON3282596,Management advisory services,Inactive,,Non-ICT,Non-ICT,52,
4652,PROPERTY MANAGEMENT SERVICES,SON3281940,Property management services,Inactive,,Non-ICT,Non-ICT,52,
4653,Supply of Pneumococcal Vaccine,SON3279385,Drugs and Pharmaceutical Products,Inactive,,Non-ICT,Non-ICT,52,
4654,IMOS Vessel Chartering,SON3020932,Commercial marine craft,Inactive,,Non-ICT,Non-ICT,52,
4655,Provision of overseas and domestic removals and storage services,SON3286779,Mail and cargo transport,Inactive,,Non-ICT,Non-ICT,52,
4656,Office Fitout Design and construction Services,SON3279935,Commercial or industrial construction,Inactive,,Non-ICT,Non-ICT,52,
4657,Council of Australian Governments (COAG) Energy Council panel,SON3285453,Management advisory services,Inactive,,Non-ICT,Non-ICT,52,
4658,Provision of Vetting Services for the Approved Destination Scheme,SON3284688,Business administration services,Inactive,,Non-ICT,Non-ICT,52,
4659,"Marketing, Media Buying, Research and Design Services Panel",SON3281294,Marketing and distribution,Inactive,,Non-ICT,Non-ICT,52,
4660,Contact Centre Services,SON3283616,Business administration services,Inactive,,Non-ICT,Non-ICT,52,
4664,Waste Management Services,SON2385761,Scrap and waste materials,Inactive,,Non-ICT,Non-ICT,52,
4665,Small Generation Unit Inspection Services Panel,SON3289121,Professional engineering services,Inactive,,NON-ICT,NON-ICT,52,
4666,Facilities Management Services,SON3289066,Management and provision of all facilities engineering modification and maintenance services for a site or platform,Inactive,,NON-ICT,NON-ICT,52,
4667,Panel for security vetting services,SON3287712,Security and personal safety,Inactive,,NON-ICT,NON-ICT,52,
4668,Self Locating Datum Marker Buoys,SON3290795,Measuring and observing and testing instruments,Inactive,,Uncategorised,Uncategorised,52,
4669,Oil Spill Control Agents,SON3290793,Environmental protection,Inactive,,Non-ICT,Non-ICT,52,
4670,Provision of National Plan Training Development Consultancy Panel,SON3290677,Education and Training Services,Inactive,,Non-ICT,Non-ICT,52,
4671,National Plan Oil Spill Response Equipement,SON3290665,Toxic and hazardous waste cleanup,Inactive,,Non-ICT,Non-ICT,52,
4672,Provision of SAFe training and related services,SON3290058,Education and Training Services,Inactive,SAFe training seems Agile related (TK 24/09/2015)ATM ID: PTP6922,Non-ICT,Non-ICT,52,
4673,Security Patrols and Concierge Duties,SON3290033,Security guard services,Inactive,,Non-ICT,Non-ICT,52,
4674,Election Training and Workplace Support Services Panel,SON3284788,Education and Training Services,Inactive,,Non-ICT,Non-ICT,52,
4675,"Printing, packaging and distribution",SON3289333,Printing,Inactive,,Non-ICT,Non-ICT,52,
4676,Engagement of contracted personnel,SON3289285,Personnel recruitment,Inactive,,Non-ICT,Non-ICT,52,
4677,Labour Hire & Recruitment Services Panel (Indigenous Businesses),SON3291540,Personnel recruitment,Inactive,ATM ID: PTP-5935,Non-ICT,Non-ICT,52,
4678,"Data storage & Management, hardware, monitoring software & profess services",SON3290962,Data Voice or Multimedia Network Equipment or Platforms and Accessories,Active,Contains multiple categories (TK 24/09/2015),ICT,Uncategorised,15,
4679,Provision of Emergency Position Indicating Radio Beacons,SON3290845,Water safety,Inactive,,Non-ICT,Non-ICT,52,
4680,"Provision of Hosting, Maintenance and Support of External Websites",SON3293318,Internet services,Active,,IT Services ,IT Managed Services,14,
4681,Supply of Manual Rain Gauges,SON3292358,Measuring and observing and testing instruments,Inactive,,Non-ICT,Non-ICT,52,
4683,Capture and Captivity Awareness Training,SON3294569,Education and Training Services,Inactive,,Non_ICT,Non_ICT,52,
4684,Mortuary and Bereavement Services,SON3293750,Disaster preparedness and relief,Inactive,,Non_ICT,Non_ICT,52,
4685,Orchestration and governance tool and associated services,SON3293561,Software,Active,IT includes associated services so could be unspecified (TK 28/09/2015),Software,Uncategorised,21,
4686,Provision of a Workstation Furniture System,SON3271852,Office furniture,Inactive,CSIRO needs to be in full form in the Agency name field or the DB will reject.,Non-ICT,Non-ICT,52,
4687,FMIS Application Support,SON3295751,Software maintenance and support,Active,,Software,Software Support,18,
4688,ICT Hardware and Associated Services Panel (ICT Hardware Panel),SON3295723,Computer Equipment and Accessories,Active,"""A whole-of-government panel for the provision of Desktop Personal Computers (PCs), Mobile PCs, Virtual Desktop Devices (VDDs), Monitors, Associated Services (including technical support, asset tagging, pre-delivery configuration, pre-delivery imagining, sanitisation and disposal services), Installation Services (including installations with and without data transfer, floor walking and support and decommissioning services), Servers and Server Racks."" Description on Austender (LW 8/10/2015)",Hardware,Uncategorised,7,
4689,Repair and Maintenance of Military Equipment,SON3296133,Launchers,Inactive,,Non-ICT,Non-ICT,52,
4690,Innovation Centre Consultancy Services Panel,SON3297000,Business intelligence consulting services,Active,,Software,Business Intelligence,20,
4691,Combat Undergarments,SON3296868,Clothing,Inactive,,Non-ICT,Non-ICT,52,
4692,Specialists Recruitment Panel,SON3296452,Personnel recruitment,Inactive,,Non-ICT,Non-ICT,52,
4693,"Supply of medals, awards, ribbons and related services",SON3298708,Medals,Inactive,,Non-ICT,Non-ICT,52,
4694,Soldier Combat Ensemble - Combat Hearing Protection,SON3298641,Personal safety and protection,Inactive,,Non-ICT,Non-ICT,52,
4695,Transcription Services for the Department of Parliamentary Services,SON3298418,Transcribing services,Inactive,,Non-ICT,Non-ICT,52,
4696,MoM Master Contract,SON3297888,Printer and facsimile and photocopier supplies,Active,,Hardware,Printer and Printer Services,8,
4697,Training Services,SON3299989,Education and Training Services,Inactive,,Non-ICT,Non-ICT,52,
4698,Financial Advisory Services,SON3297361,Management advisory services,Inactive,,Non-ICT,Non-ICT,52,
4700,Uluru Kata Tjuta National Park (UKTNP) Cleaning Services Contract,SON3301680,Cleaning and janitorial services,Inactive,,Non-ICT,Non-ICT,52,
4701,"Supply of Shipping Container (ISO) and Container, Tricon",SON3301290,Containers and storage,Inactive,,Non-ICT,Non-ICT,52,
4702,Supply of Harcourt No. 2 granite chips,SON3301196,Masonry and stonework and tile setting,Inactive,,Non-ICT,Non-ICT,52,
4703,Waste Management Services,SON3301193,Refuse collection and disposal,Inactive,,Non-ICT,Non-ICT,52,
4704,Supply of Goods and Services,SON3299745,Electrical services,Inactive,,Non-ICT,Non-ICT,52,
4705,Supply of Goods and services,SON3299746,Electrical services,Inactive,,Non-ICT,Non-ICT,52,
4707,Provision of Advisory Services under the Medical and Health Advisory Servic,SON3302917,Comprehensive health services,Inactive,,Non-ICT,Non-ICT,52,
4708,Debt Management Services,SON3302782,Debt management,Inactive,,Non-ICT,Non-ICT,52,
4709,Provision of IT Contractors Panel of Indigenous Suppliers,SON3301873,Computer programmers,Active,ATM ID: PTP-7135,Labour Hire,ICT Labour Hire,13,
4710,Corporate Banking Services,SON3303950,Banking and investment,Inactive,,Non-ICT,Non-ICT,52,
4711,Research Services Panel,SON3298535,Market research,Inactive,,Non-ICT,Non-ICT,52,
4712,Hospitality and housekeeping services,SON3303078,General building and office cleaning and maintenance services,Inactive,,Non-ICT,Non-ICT,52,
4713,Security Services Panel,SON3305956,Security and personal safety,Inactive,,Non-ICT,Non-ICT,52,
4714,Exhibitions Temporary Personnel Panel,SON3305766,Temporary personnel services,Inactive,,Non-ICT,Non-ICT,52,
4715,Basic Rifle Forward Grips,SON3305757,Arms and ammunition accessories,Inactive,,Non-ICT,Non-ICT,52,
4716,"Provision of uniforms, equipment and promotional material",SON3305709,Clothing,Inactive,,Non-ICT,Non-ICT,52,
4717,Enhanced Day Sight,SON3305676,Arms and ammunition accessories,Inactive,,Non-ICT,Non-ICT,52,
4718,Business Advisory Panel,SON3305648,Management advisory services,Inactive,,Non-ICT,Non-ICT,52,
4719,Solomon Island Resource Facility,SON3304932,Management advisory services,Inactive,,Non-ICT,Non-ICT,52,
4720,Risk Management Training and Education Services,SON3304872,Education and Training Services,Inactive,,Non-ICT,Non-ICT,52,
4728,Major Office Machines - Equipment and Support,SON3306975,Office machines and their supplies and accessories,Active,,Hardware,Printer and Printer Services,8,
4729,Forward Grip/ Weapon Stabiliser,SON3306957,Arms and ammunition accessories,Inactive,,Non-ICT,Non-ICT,52,
4730,Audio Recording and Transcribing Services,SON3297016,Transcribing services,Inactive,,Non-ICT,Non-ICT,52,
4731,Establishment of a Panel for Parametric Costing Tools and Associated Services,SON3306205,Software,Active,,Software,Business Systems,21,
4732,Provision of scientific reviewers,SON3307029,Medical science research and experimentation,Inactive,,Non-ICT,Non-ICT,52,
4733,Panel for the Provision of Consultancy Services,SON3309941,Architectural engineering,Inactive,,Non-ICT,Non-ICT,52,
4734,Technology Maintenance and Enhancement services,SON3310426,Building construction and support and maintenance and repair services,Active,"Appears to be a telescope, that measures satellite distances with laser. Panel is for upgrades and maintainence. The part of this that is within our categorisation is the software for the systems. The RFT associated with this makes a big deal about the software, so I think we should include, but as Software/Technical. (LW 16/12/2015)",Software,Technical,31,
4735,Provision of Salary Packaging and Novated Lease Services,SON3310187,Human resources services,Inactive,,Non-ICT,Non-ICT,52,
4736,Image Intensification Sights,SON3310153,Arms and ammunition accessories,Inactive,,Non-ICT,Non-ICT,52,
4737,Supply of Radiosondes and Ozonesondes,SON3309191,Laboratory and scientific equipment,Inactive,,Non-ICT,Non-ICT,52,
4738,Visual Illumination Device,SON3308966,Arms and ammunition accessories,Inactive,,Non-ICT,Non-ICT,52,
4739,"Production, printing, storage and packaging of Ballot Materials",SON3305741,Printing,Inactive,,Non-ICT,Non-ICT,52,
4740,Workstation and Furniture Panel,SON3308533,Furniture,Inactive,,Non-ICT,Non-ICT,52,
4741,Supply of firearms,SON3308265,Light weapons and ammunition,Inactive,,Non-ICT,Non-ICT,52,
4742,Offset Rail,SON3307719,Light weapons and ammunition,Inactive,,Non-ICT,Non-ICT,52,
4743,Supply electricity to Commonwealth Government agencies in ACT,SON3307570,Electric utilities,Inactive,,Non-ICT,Non-ICT,52,
4744,Software certification,SON3311650,Software,Active,,Software,Uncategorised,28,
4745,Brigade Labour Hire Services,SON3312425,Vehicle maintenance and repair services,Inactive,,Non-ICT,Non-ICT,52,
4746,"Software, maintenance, support and services",SON3312367,Software maintenance and support,Active,,Software,Software Support,18,
4747,Panel for Expert Advisory Services,SON3312910,Management advisory services,Inactive,,Non-ICT,Non-ICT,52,
4748,Specialist communications advice and services,SON3312615,Public relation services,Inactive,,Non-ICT,Non-ICT,52,
4749,"Standing Offer for the supply of HF, VHF and UHF radios and ancillaries",SON3312185,Communications Devices and Accessories,Inactive,Radios not included (TK 13/01/2016) Agree (LW 13/01/2016),Non-ICT,Non-ICT,52,
4750,Indian Ocean Territories Nursing Services,SON3313694,Emergency and field medical services products,Inactive,,Non-ICT,Non-ICT,52,
4751,Security Equipment and Maintenance Services,SON3315564,Security and control equipment,Inactive,,Non-ICT,Non-ICT,52,
4752,Supply of Vaccines in relation to a catch-up programe for 10-19 year olds,SON3312025,Drugs and Pharmaceutical Products,Inactive,,Non-ICT,Non-ICT,52,
4753,WOG ACT Electricity Supply,SON3315221,Electric utilities,Inactive,,Non-ICT,Non-ICT,52,
4754,Infrastructure Project Cost Estimation Services,SON3312041,Economic or financial evaluation of projects,Inactive,,Non-ICT,Non-ICT,52,
4758,Belt-Harness System,SON3316426,Safety apparel,Inactive,,Non-ICT,Non-ICT,52,
4759,Audit Services - Contract In Supplementary Staff,SON3316284,Audit services,Inactive,,Non-ICT,Non-ICT,52,
4760,Provision of a temporary election workforce,SON3312358,Temporary personnel services,Inactive,,Non-ICT,Non-ICT,52,
4761,Supplier Assurance and WHS Services,SON3320609,Risk management consultation services,Inactive,,Non-ICT,Non-ICT,52,
4762,Mercantile Agent Service for Debt Recovery,SON3316979,Debt management,Inactive,,Non-ICT,Non-ICT,52,
4763,"Provision of ADF Fuel, POL Supplies and Card Services",SON3319691,Fuels,Inactive,,Non-ICT,Non-ICT,52,
4764,"Provision of ADF Fuel, POL Supplies and Card Services",SON3319690,Fuels,Inactive,,Non-ICT,Non-ICT,52,
4765,"Provision of ADF Fuel, POL Supplies and Card Services",SON3319689,Fuels,Inactive,,Non-ICT,Non-ICT,52,
4766,"Provision of ADF Fuel, POL Supplies and Card Services",SON3319688,Fuels,Inactive,,Non-ICT,Non-ICT,52,
4767,"Provision of ADF Fuel, POL Supplies and Card Services",SON3319680,Fuels,Inactive,,Non-ICT,Non-ICT,52,
4768,Freight Forwarding and Shipping Services,SON3321927,Freight forwarders services,Inactive,,Non-ICT,Non-ICT,52,
4769,AWD Combat System Services and Materials,SON3321914,Military watercraft,Inactive,,Non-ICT,Non-ICT,52,
4770,"Provision of ADF Fuel, POL Supplies and Card Services",SON3321884,Fuels,Inactive,,Non-ICT,Non-ICT,52,
4771,"Provision of ADF Fuel, POL Supplies and Card Services",SON3321881,Fuels,Inactive,,Non-ICT,Non-ICT,52,
4772,Transport Container & Dec Envelope Storage Container,SON3320447,Containers and storage,Inactive,,Non-ICT,Non-ICT,52,
4773,Interpreter services for international and sign languages,SON3283258,Interpreters,Inactive,,Non-ICT,Non-ICT,52,
4775,Provision of Charter Vessel Services,SON3323027,Commercial marine craft,Inactive,,Non-ICT,Non-ICT,52,
4776,Supply of DTPa vaccine for 18 month olds,SON3322608,Drugs and Pharmaceutical Products,Inactive,,Non-ICT,Non-ICT,52,
4777,IP Rights Register Search Solution,SON3322756,Software,Active,,Software,Content and Knowledge Management,22,
4778,Locksmith Services - ACT,SON3318611,Locks and security hardware and accessories,Inactive,,Non-ICT,Non-ICT,52,
4782,Campaign Advertising Strategy and Creative/Concept Solution,SON3325002,Advertising,Inactive,,Non-ICT,Non-ICT,52,
4783,Capacity Design and Evaluation Services,SON3324750,Management advisory services,Inactive,,Non-ICT,Non-ICT,52,
4784,Support for TechnologyOne FMIS,SON3323670,Management information systems MIS,Active,"Description ""Standing Offer for the provision of TechnologyOne FMIS application support"", Chartsmart consultants only supplier as at 9/03/2016. Suggest category is Software Support (9/03/2016)",Software,Software Support,18,
4785,"Agreement for the provision of ICT Hardware, Software, Documentation and Se",SON3326360,Communications Devices and Accessories,Active,,IT Services,SI Services,17,
4786,Continuous Positive Airway Pressure and/or Home Medical Oxygen Therapy,SON3326235,Independent living aids for the physically challenged,Inactive,,Non-ICT,Non-ICT,52,
4787,Feature Data Extraction Services,SON3325427,Military services and national defence,Inactive,"Probably not ICT, suppliers are Geo/mapping specialists and Data Extraction is not really inscope for ICT. (LW 22/03/2016)",Non-ICT,Non-ICT,52,
4788,Inscription of marble headstones for Commonwealth War Graves and Australia,SON3327946,Building construction and support and maintenance and repair services,Inactive,,Non-ICT,Non-ICT,52,
4789,Standing Offer for the supply of Laboratory Gas,SON3320690,Elements and gases,Inactive,,Non-ICT,Non-ICT,52,
4790,"Collaborative Evaluation, Research and Planning Panel (CERP Panel)",SON3329485,Community and social services,Inactive,,Non-ICT,Non-ICT,52,
4791,Property and Project Management Services Panel,SON3328191,Building support services,Inactive,,Non-ICT,Non-ICT,52,
4792,Creative Services for the National Tobacco Campaign,SON3328350,Advertising,Inactive,,Non-ICT,Non-ICT,52,
4793,Creative Services for the National Tobacco Campaign,SON3328685,Advertising,Inactive,,Non-ICT,Non-ICT,52,
4794,"Cup, Water Canteen, Steel",SON3328945,Camping and outdoor equipment and accessories,Inactive,,Non-ICT,Non-ICT,52,
4795,Plastic bags,SON3323697,Packaging materials,Inactive,,Non-ICT,Non-ICT,52,
4796,Media monitoring services,SON3321693,Telecommunications media services,Inactive,,Non-ICT,Non-ICT,52,
4798,Creative Services for Aged Care Changes Campaign,SON3327575,Advertising,Inactive,,Non-ICT,Non-ICT,52,
4799,"Records, IT Media, Storage, Sentencing, Disposal, & Digitisation Services",SON3331965,Document storage services,Active,,Hardware,Storage,9,
4800,Building Management Services,SON3331953,Security or access control systems,Inactive,,Non-ICT,Non-ICT,52,
4801,Goods and Maintenance Services for the Barrett Sniper Rifle,SON3331722,Arms and ammunition accessories,Inactive,,Non-ICT,Non-ICT,52,
4802,Software Maintenance and Support Services,SON3331680,Software maintenance and support,Active,,Software,Software Support,18,
4805,Provision of Petroleum Reservoir Engineering Advice Services,SON3333977,Management advisory services,Inactive,,Non-ICT,Non-ICT,52,
4806,Specialist Indigenous communications advice and services,SON3327595,Public relation services,Inactive,,Non-ICT,Non-ICT,52,
4807,Supply of medium & long range sniper day sights,SON3333571,Arms and ammunition accessories,Inactive,,Non-ICT,Non-ICT,52,
4808,Supply of National Police Certificate Paper,SON3333238,Paper products,Inactive,,Non-ICT,Non-ICT,52,
4809,Actuarial Services Panel,SON3333134,Development finance,Inactive,,Non-ICT,Non-ICT,52,
4810,National Advocacy Training Program,SON3332257,Education and Training Services,Inactive,,Non-ICT,Non-ICT,52,
4813,Employee Assistance and Psycological Services,SON3334479,Psychologists services,Inactive,,Non-ICT,Non-ICT,52,
4814,Media Monitoring Services,SON3310543,News and publicity services,Inactive,ATM ID:,Non-ICT,Non-ICT,52,
4815,Thermal Imaging Sights,SON3311189,Arms and ammunition accessories,Inactive,ATM ID:,Non-ICT,Non-ICT,52,
4816,Health Technology Assessment Panel,SON3281043,Health programs,Inactive,ATM ID: Health/62/1415,Non-ICT,Non-ICT,52,
4817,Valuation and estimation services,SON3305682,Business administration services,Inactive,ATM ID: RFT 1000280496,Non-ICT,Non-ICT,52,
4818,"Mail, Freight and Courier services",SON3310240,Postal and small parcel and courier services,Inactive,ATM ID: AEC15/038,Non-ICT,Non-ICT,52,
4819,The provision of case management software and related services,SON3311590,Software,Active,ATM ID:,Software,Business Systems,21,
4820,Office Machines and Supplies,SON3311646,Office machines and their supplies and accessories,Active,ATM ID: FIN10/FMG018,Hardware,Printer and Printer Services,8,
4821,Panel for Psychological Assessment Services,SON3311885,Psychologists services,Inactive,ATM ID: DISG RFT 2015 /02ATM ID: DISG RFT 2015 /02,Non-ICT,Non-ICT,52,
4822,Soldier Combat Ensemble - Tiered Combat Helmets,SON3311934,Face and head protection,Inactive,ATM ID: DMOLSD/RFT0225/2014,Non-ICT,Non-ICT,52,
4823,"Records, IT Media, Storage, Sentencing, Disposal and Digitisation Services",SON3317337,Document storage services,Inactive,ATM ID: CASA13/275,Non-ICT,Non-ICT,52,
4824,Task and Meeting Room Chairs,SON3303962,Office furniture,Inactive,ATM ID: CSIRORFT2015031,Non-ICT,Non-ICT,52,
4825,Workplace Storage Units,SON3304453,Office furniture,Inactive,ATM ID: CSIRORFT2015030,Non-ICT,Non-ICT,52,
4826,Provision Of Global Navigation Satellite Systems Equipment,SON3311734,Earth science services,Active,ATM ID: RFT2015/3112,Hardware,Unspecified,7,
4827,Furniture Conservation Services at Australian Parliament House,SON3318435,Furniture,Inactive,ATM ID: DPS14127,Non-ICT,Non-ICT,52,
4828,Security Monitoring and Alarm Maintenance Services,SON3318597,Security and control equipment,Inactive,ATM ID:,Non-ICT,Non-ICT,52,
4829,Canteen Water Plastic,SON3318896,Camping and outdoor equipment and accessories,Inactive,ATM ID: DMOLSD/RFT0031/2013,Non-ICT,Non-ICT,52,
4830,Provision of Salary Packaging and Novated Lease Services,SON3318927,Human resources services,Inactive,ATM ID: CASA 12/124,Non-ICT,Non-ICT,52,
4831,"Arts for Recovery, Resilience, Teamwork & Skills (ARRTS) Program",SON3337440,Education and Training Services,Inactive,ATM ID: Army/1516/012,Non-ICT,Non-ICT,52,
4832,Air Travel Services for the Australian Government,SON3337469,Passenger air transportation,Inactive,ATM ID:,Non-ICT,Non-ICT,52,
4833,Enterprise Data Management Enviroment,SON3338269,Components for information technology or broadcasting or telecommunications,Active,ATM ID:,Software,Content and Knowledge Management,22,
4834,Major Office Machines arrangement with Konica,SON3338949,Office machines and their supplies and accessories,Active,ATM ID: FIN10/FMG018,Hardware,Printer and Printer Services,8,
4835,Papua New Guinea Governance Facility,SON3339438,Business administration services,Inactive,ATM ID:,Non-ICT,Non-ICT,52,
4845,Family and Domestic Violence Training,SON3329092,Education and Training Services,Inactive,,Non-ICT,Non-ICT,52,
4855,Carpet Manufacture and Supply,SON3338997,Floor coverings,Inactive,ATM ID: DPS14006,Non-ICT,Non-ICT,52,
4863,Suicide Risk Assessment and Intervention Training,SON3329081,Education and Training Services,Inactive,,Non-ICT,Non-ICT,52,
